ID	Language	Gloss	GlossID	CogID	IPA	Tokens	NewCogID	
1	Maloh	hand	1	155	taŋan	t a ŋ a n	881	
2	Merina (Malagasy)	hand	1	155	tanana	t a n a n a	881	
3	Thao	hand	1	446	rima	r i m a	881	
4	Palauan	hand	1	446	cʰim	cʰ i m	881	
5	Tunjung	hand	1	155	aŋaʔ	a ŋ a ʔ	881	
6	Bare'e	hand	1	1484	pale	p a l e	881	
7	Iban	hand	1	155	taŋan	t a ŋ a n	881	
8	Iban	hand	1	1556	jari	j a r i	881	
9	Berawan (Long Terawan)	hand	1	481	tisu	t i s u	881	
10	Berawan (Long Terawan)	hand	1	481	isu	i s u	328	
11	Hanunoo	hand	1	1796	kamaŋ	k a m a ŋ	881	
12	Wuna	hand	1	446	lima	l i m a	881	
13	Tetum	hand	1	446	liman	l i m a n	881	
14	Mailu	hand	1	446	ima	i m a	881	
15	Tsou	hand	1	350	mucu	m u c u	465	
16	Nias	hand	1	155	taŋa	t a ŋ a	881	
17	Central Amis	hand	1	19	kamaj	k a m a j	881	
18	Chamorro	hand	1	2515	kanːai	k a nː a i	881	
19	Banoni	hand	1	446	numa	n u m a	881	
20	Singhi	hand	1	155	toŋan	t o ŋ a n	881	
21	Maloh	left	2	1000	kajoko	k a j o k o	712	
22	Merina (Malagasy)	left	2	-483	havia	h a v i a	712	
23	Palauan	left	2	1253	katur	k a t u r	712	
24	Tunjung	left	2	645	ulaj	u l a j	712	
25	Bare'e	left	2	483	kaiː	k a iː	592	
26	Iban	left	2	560	kibaʔ	k i b a ʔ	712	
27	Berawan (Long Terawan)	left	2	645	pəmaiŋ	p ə m a i ŋ	712	
28	Moken	left	2	1702	ʔeloj	ʔ e l o j	712	
29	Hanunoo	left	2	159	wala	w a l a	712	
30	Wuna	left	2	98	kema	k e m a	712	
31	Tetum	left	2	1881	karuk	k a r u k	712	
32	Mailu	left	2	1934	ebe	e b e	712	
33	Tsou	left	2	483	vrina	v r i n a	609	
34	Nias	left	2	2227	kabera	k a b e r a	712	
35	Central Amis	left	2	483	kawili	k a w i l i	712	
36	Chamorro	left	2	2516	akague	a k a g u e	712	
37	Banoni	left	2	2601	tororona	t o r o r o n a	223	
38	Singhi	left	2	2743	bait	b a i t	409	
39	Banggi	left	2	-159	kuikiwaŋ	k u i k i w a ŋ	444	
40	Maloh	right	3	-519	kato	k a t o	769	
41	Merina (Malagasy)	right	3	255	havanana	h a v a n a n a	769	
42	Palauan	right	3	1254	kadikm	k a d i k m	769	
43	Tunjung	right	3	519	tauʔ	t a u ʔ	769	
44	Bare'e	right	3	255	kana	k a n a	769	
45	Iban	right	3	255	kanan	k a n a n	769	
46	Berawan (Long Terawan)	right	3	519	pəŋkatuʔoh	p ə ŋ k a t u ʔ o h	378	
47	Moken	right	3	255	nanaːn	n a n aː n	769	
48	Hanunoo	right	3	-184	sikun	s i k u n	769	
49	Wuna	right	3	255	swana	s w a n a	769	
50	Tetum	right	3	255	kwana	k w a n a	769	
51	Mailu	right	3	1935	iata	i a t a	347	
52	Tsou	right	3	255	vhona	v h o n a	769	
53	Nias	right	3	2228	kawõlõ	k a w õ l õ	298	
54	Central Amis	right	3	255	kawanan	k a w a n a n	769	
55	Banoni	right	3	519	matoː	m a t oː	769	
56	Singhi	right	3	519	toux	t o u x	769	
57	Banggi	right	3	-184	kikuan	k i k u a n	769	
58	Merina (Malagasy)	leg/foot	4	-97	ranjo	r a n j o	977	
59	Merina (Malagasy)	leg/foot	4	1053	toŋotra	t o ŋ o t r a	983	
60	Thao	leg/foot	4	1161	kuskus	k u s k u s	977	
61	Palauan	leg/foot	4	-290	oacʰ	o a cʰ	977	
62	Tunjung	leg/foot	4	1401	uneŋ	u n e ŋ	977	
63	Bare'e	leg/foot	4	28	witi	w i t i	977	
64	Iban	leg/foot	4	290	kaki	k a k i	977	
65	Iban	leg/foot	4	1557	pah	p a h	977	
66	Berawan (Long Terawan)	leg/foot	4	366	gimaʔ	g i m a ʔ	977	
67	Moken	leg/foot	4	199	pakaʔ	p a k a ʔ	977	
68	Moken	leg/foot	4	290	kakaj	k a k a j	977	
69	Hanunoo	leg/foot	4	1797	raparapa	r a p a r a p a	977	
70	Wuna	leg/foot	4	290	gʰagʰe	gʰ a gʰ e	977	
71	Tetum	leg/foot	4	290	ain	a i n	977	
72	Mailu	leg/foot	4	1936	au	a u	977	
73	Tsou	leg/foot	4	2099	ruru	r u r u	186	
74	Nias	leg/foot	4	290	ahe	a h e	977	
75	Central Amis	leg/foot	4	290	waqaj	w a q a j	977	
76	Chamorro	leg/foot	4	2517	adːeŋ	a dː e ŋ	977	
77	Banoni	leg/foot	4	2602	rapinːa	r a p i nː a	391	
78	Singhi	leg/foot	4	2744	peun	p e u n	977	
79	Banggi	leg/foot	4	290	uei	u e i	977	
80	Maloh	to walk	5	563	lambaʔ	l a m b a ʔ	849	
81	Merina (Malagasy)	to walk	5	1054	mandéha	m a n d é h a	674	
82	Palauan	to walk	5	212	merael	m e r a e l	849	
83	Tunjung	to walk	5	212	calan	c a l a n	849	
84	Bare'e	to walk	5	99	linja	l i n j a	849	
85	Iban	to walk	5	212	jalai	j a l a i	849	
86	Berawan (Long Terawan)	to walk	5	57	lakaw	l a k a w	849	
87	Moken	to walk	5	57	lakaw	l a k a w	849	
88	Hanunoo	to walk	5	57	lumakaw	l u m a k a w	849	
89	Wuna	to walk	5	362	nokala	n o k a l a	849	
90	Tetum	to walk	5	57	laʔo	l a ʔ o	849	
91	Mailu	to walk	5	1937	baebae	b a e b a e	849	
92	Tsou	to walk	5	2100	coeconʉ	c o e c o n ʉ	894	
93	Nias	to walk	5	416	fanõ	f a n õ	849	
94	Central Amis	to walk	5	690	lumakat	l u m a k a t	849	
95	Central Amis	to walk	5	690	rumakat	r u m a k a t	849	
96	Chamorro	to walk	5	57	lahu	l a h u	849	
97	Singhi	to walk	5	416	ponu	p o n u	849	
98	Banggi	to walk	5	416	empaːno	e m p aː n o	849	
99	Maloh	road/path	6	95	dalan	d a l a n	678	
100	Merina (Malagasy)	road/path	6	95	lalana	l a l a n a	678	
101	Thao	road/path	6	95	saran	s a r a n	678	
102	Palauan	road/path	6	95	rael	r a e l	678	
103	Tunjung	road/path	6	95	loroŋ	l o r o ŋ	986	
104	Bare'e	road/path	6	95	jaja	j a j a	678	
105	Iban	road/path	6	95	jalai	j a l a i	678	
106	Berawan (Long Terawan)	road/path	6	95	ilan	i l a n	678	
107	Hanunoo	road/path	6	95	dalan	d a l a n	678	
108	Wuna	road/path	6	95	sala	s a l a	678	
109	Tetum	road/path	6	95	dalan	d a l a n	678	
110	Mailu	road/path	6	1938	laea	l a e a	678	
111	Tsou	road/path	6	95	ceonʉ	c e o n ʉ	678	
112	Nias	road/path	6	95	lala	l a l a	678	
113	Central Amis	road/path	6	95	lalan	l a l a n	678	
114	Chamorro	road/path	6	95	cʰalan	cʰ a l a n	678	
115	Banoni	road/path	6	95	sanana	s a n a n a	678	
116	Singhi	road/path	6	95	aran	a r a n	678	
117	Maloh	to come	7	1001	mondok	m o n d o k	890	
118	Merina (Malagasy)	to come	7	154	avj	a v j	890	
119	Merina (Malagasy)	to come	7	1055	toŋa	t o ŋ a	565	
120	Thao	to come	7	1162	munaj	m u n a j	890	
121	Palauan	to come	7	719	méi	m é i	890	
122	Tunjung	to come	7	1402	moːt	m oː t	890	
123	Bare'e	to come	7	719	maʔi	m a ʔ i	890	
124	Iban	to come	7	-561	datai	d a t a i	890	
125	Berawan (Long Terawan)	to come	7	1631	liʔ	l i ʔ	890	
126	Moken	to come	7	1703	ŋadin	ŋ a d i n	37	
127	Hanunoo	to come	7	1798	balik	b a l i k	890	
128	Wuna	to come	7	719	mai	m a i	890	
129	Tetum	to come	7	719	mai	m a i	890	
130	Mailu	to come	7	-719	ai	a i	890	
131	Tsou	to come	7	3	oh	o h	890	
132	Tsou	to come	7	3	uso	u s o	890	
133	Nias	to come	7	719	mõi	m õ i	890	
134	Central Amis	to come	7	2334	tajni	t a j n i	890	
135	Singhi	to come	7	2745	nug	n u g	890	
136	Banggi	to come	7	2845	miaːtaŋ	m i aː t a ŋ	890	
137	Maloh	to turn	8	1002	lempaŋ	l e m p a ŋ	915	
138	Merina (Malagasy)	to turn	8	-367	vilj	v i l j	915	
139	Thao	to turn	8	1163	taushuqish	t a u s h u q i s h	915	
140	Palauan	to turn	8	1255	meŋesoim	m e ŋ e s o i m	9	
141	Tunjung	to turn	8	1403	nencaŋ	n e n c a ŋ	735	
142	Bare'e	to turn	8	591	gili	g i l i	915	
143	Iban	to turn	8	431	bilok	b i l o k	915	
144	Berawan (Long Terawan)	to turn	8	1632	ŋəlibiʔ	ŋ ə l i b i ʔ	128	
145	Moken	to turn	8	1704	nʲiliək	nʲ i l i ə k	915	
146	Hanunoo	to turn	8	1799	simaŋ	s i m a ŋ	915	
147	Wuna	to turn	8	1860	nobelo	n o b e l o	915	
148	Tetum	to turn	8	-367	filas	f i l a s	915	
149	Tetum	to turn	8	-367	fila	f i l a	915	
150	Tetum	to turn	8	-367	faur	f a u r	915	
151	Tsou	to turn	8	2101	miunu	m i u n u	653	
152	Central Amis	to turn	8	2335	maliwuŋ	m a l i w u ŋ	915	
153	Banoni	to turn	8	2603	beruː	b e r uː	43	
154	Banoni	to turn	8	2604	vegom	v e g o m	943	
155	Singhi	to turn	8	2746	kus	k u s	915	
156	Maloh	to swim	9	-311	arananaŋ	a r a n a n a ŋ	900	
157	Merina (Malagasy)	to swim	9	543	lomano	l o m a n o	900	
158	Merina (Malagasy)	to swim	9	1056	milomano	m i l o m a n o	900	
159	Thao	to swim	9	1164	mrauz	m r a u z	900	
160	Palauan	to swim	9	1256	meŋedub	m e ŋ e d u b	900	
161	Tunjung	to swim	9	543	karaŋoj	k a r a ŋ o j	900	
162	Bare'e	to swim	9	543	naŋu	n a ŋ u	900	
163	Iban	to swim	9	1558	njemerai	n j e m e r a i	900	
164	Berawan (Long Terawan)	to swim	9	543	pəloŋoj	p ə l o ŋ o j	900	
165	Moken	to swim	9	543	naŋoj	n a ŋ o j	900	
166	Hanunoo	to swim	9	543	lumaŋuj	l u m a ŋ u j	900	
167	Wuna	to swim	9	543	leni	l e n i	900	
168	Tetum	to swim	9	543	nani	n a n i	900	
169	Mailu	to swim	9	540	loroloro	l o r o l o r o	532	
170	Mailu	to swim	9	540	rolorolo	r o l o r o l o	730	
171	Tsou	to swim	9	543	euhuŋzu	e u h u ŋ z u	681	
172	Nias	to swim	9	543	molaŋi	m o l a ŋ i	900	
173	Central Amis	to swim	9	543	laŋuj	l a ŋ u j	900	
174	Central Amis	to swim	9	543	milaŋuj	m i l a ŋ u j	900	
175	Chamorro	to swim	9	543	naŋunʲaŋu	n a ŋ u nʲ a ŋ u	900	
176	Banoni	to swim	9	789	suː	s uː	478	
177	Singhi	to swim	9	543	naŋuj	n a ŋ u j	900	
178	Merina (Malagasy)	dirty	10	242	maloto	m a l o t o	1026	
179	Thao	dirty	10	1165	marisrisin	m a r i s r i s i n	1026	
180	Palauan	dirty	10	1257	idokel	i d o k e l	101	
181	Tunjung	dirty	10	242	marotaʔ	m a r o t a ʔ	1026	
182	Bare'e	dirty	10	1485	sapa	s a p a	1026	
183	Iban	dirty	10	667	kamah	k a m a h	1026	
184	Berawan (Long Terawan)	dirty	10	1633	labih	l a b i h	1026	
185	Moken	dirty	10	1705	caʔiək	c a ʔ i ə k	1026	
186	Hanunoo	dirty	10	423	majagtiŋ	m a j a g t i ŋ	1026	
187	Hanunoo	dirty	10	423	maʔuriŋ	m a ʔ u r i ŋ	1026	
188	Wuna	dirty	10	785	noraku	n o r a k u	1026	
189	Tetum	dirty	10	1882	kfur	k f u r	1026	
190	Tetum	dirty	10	1883	karebo	k a r e b o	320	
191	Mailu	dirty	10	335	milomilo	m i l o m i l o	112	
192	Tsou	dirty	10	79	cai	c a i	1026	
193	Tsou	dirty	10	79	caʔi	c a ʔ i	1026	
194	Nias	dirty	10	-401	moŋdaʔi	m o ŋ d a ʔ i	643	
195	Central Amis	dirty	10	2336	maacek	m a a c e k	1026	
196	Central Amis	dirty	10	2337	makalit	m a k a l i t	1026	
197	Chamorro	dirty	10	2518	hoplat	h o p l a t	787	
198	Banoni	dirty	10	2605	kiːpi	k iː p i	1026	
199	Singhi	dirty	10	2747	kais	k a i s	1026	
200	Singhi	dirty	10	2748	sirida	s i r i d a	125	
201	Banggi	dirty	10	567	damak	d a m a k	1026	
202	Merina (Malagasy)	dust	11	1057	vovoka	v o v o k a	941	
203	Bare'e	dust	11	182	awu	a w u	941	
204	Iban	dust	11	703	abu	a b u	941	
205	Iban	dust	11	182	apok	a p o k	941	
206	Berawan (Long Terawan)	dust	11	182	apoʔ	a p o ʔ	941	
207	Moken	dust	11	703	kaboj	k a b o j	941	
208	Hanunoo	dust	11	182	gabuk	g a b u k	941	
209	Hanunoo	dust	11	182	pukapuk	p u k a p u k	941	
210	Tetum	dust	11	-182	rai#ahun	r a i # a h u n	941	
211	Mailu	dust	11	1939	veve	v e v e	980	
212	Central Amis	dust	11	2338	taʔfod	t a ʔ f o d	941	
213	Banoni	dust	11	2606	ramuta	r a m u t a	941	
214	Singhi	dust	11	182	abux	a b u x	941	
215	Singhi	dust	11	182	sapok	s a p o k	941	
216	Banggi	dust	11	-182	auː	a uː	941	
217	Maloh	skin	12	216	kulit	k u l i t	866	
218	Merina (Malagasy)	skin	12	-216	hoditra	h o d i t r a	866	
219	Thao	skin	12	1166	shapa	s h a p a	866	
220	Palauan	skin	12	1258	budél	b u d é l	866	
221	Tunjung	skin	12	216	kulit	k u l i t	866	
222	Bare'e	skin	12	1486	pela	p e l a	866	
223	Iban	skin	12	216	kulit	k u l i t	866	
224	Berawan (Long Terawan)	skin	12	216	kulaiʔ	k u l a i ʔ	866	
225	Moken	skin	12	1706	bulaŋ	b u l a ŋ	866	
226	Hanunoo	skin	12	428	tarip	t a r i p	866	
227	Hanunoo	skin	12	1800	lukub	l u k u b	866	
228	Wuna	skin	12	216	kuli	k u l i	866	
229	Tetum	skin	12	216	kulit	k u l i t	866	
230	Mailu	skin	12	768	opi	o p i	801	
231	Tsou	skin	12	2102	snʉ́fʉ	s n ʉ́ f ʉ	488	
232	Nias	skin	12	216	uli	u l i	866	
233	Central Amis	skin	12	835	faŋes	f a ŋ e s	866	
234	Central Amis	skin	12	835	faŋes	f a ŋ e s	866	
235	Chamorro	skin	12	2519	lasːas	l a sː a s	866	
236	Banoni	skin	12	2607	kabunu	k a b u n u	801	
237	Singhi	skin	12	216	kurit	k u r i t	866	
238	Banggi	skin	12	-216	kubal	k u b a l	866	
239	Maloh	back	13	838	balakaŋ	b a l a k a ŋ	806	
240	Thao	back	13	832	rikus	r i k u s	806	
241	Palauan	back	13	1259	uulk	u u l k	806	
242	Tunjung	back	13	621	puŋuŋ	p u ŋ u ŋ	806	
243	Bare'e	back	13	832	taliku	t a l i k u	806	
244	Iban	back	13	838	belakaŋ	b e l a k a ŋ	806	
245	Berawan (Long Terawan)	back	13	832	likon	l i k o n	806	
246	Moken	back	13	832	lekoːt	l e k oː t	806	
247	Hanunoo	back	13	1801	daju	d a j u	774	
248	Tetum	back	13	111	kotːuk	k o tː u k	774	
249	Mailu	back	13	-157	deniabo	d e n i a b o	229	
250	Mailu	back	13	1940	doe	d o e	806	
251	Tsou	back	13	348	fʔuhu	f ʔ u h u	806	
252	Nias	back	13	2229	hulu	h u l u	806	
253	Central Amis	back	13	2339	kulur	k u l u r	806	
254	Central Amis	back	13	2340	koror	k o r o r	806	
255	Banoni	back	13	2608	tsugʰi	t s u gʰ i	774	
256	Singhi	back	13	2749	dug	d u g	15	
257	Maloh	belly	14	146	bataŋ	b a t a ŋ	1015	
258	Merina (Malagasy)	belly	14	1058	kibo	k i b o	1015	
259	Thao	belly	14	17	tiaz	t i a z	1015	
260	Palauan	belly	14	-17	diil	d i i l	1015	
261	Tunjung	belly	14	1404	naiʔ	n a i ʔ	1015	
262	Bare'e	belly	14	249	kompo	k o m p o	1015	
263	Iban	belly	14	840	perut	p e r u t	1015	
264	Berawan (Long Terawan)	belly	14	17	tijan	t i j a n	1015	
265	Moken	belly	14	1707	lakeʔ	l a k e ʔ	1015	
266	Hanunoo	belly	14	17	tijan	t i j a n	1015	
267	Wuna	belly	14	76	tagʰi	t a gʰ i	1015	
268	Tetum	belly	14	-249	kabun	k a b u n	1015	
269	Mailu	belly	14	1941	amara	a m a r a	1015	
270	Tsou	belly	14	2103	bʉeo	b ʉ e o	610	
271	Nias	belly	14	2230	talu	t a l u	1015	
272	Central Amis	belly	14	17	tial	t i a l	1015	
273	Central Amis	belly	14	17	tial	t i a l	1015	
274	Chamorro	belly	14	17	tujan	t u j a n	1015	
275	Banoni	belly	14	-674	kobi	k o b i	71	
276	Singhi	belly	14	17	tain	t a i n	1015	
277	Banggi	belly	14	17	tiagn	t i a g n	1015	
278	Maloh	bone	15	644	tulaŋ	t u l a ŋ	852	
279	Merina (Malagasy)	bone	15	644	taolana	t a o l a n a	852	
280	Thao	bone	15	1167	puqu	p u q u	852	
281	Palauan	bone	15	1260	cʰiuis	cʰ i u i s	852	
282	Tunjung	bone	15	1405	lah	l a h	852	
283	Bare'e	bone	15	475	wuku	w u k u	852	
284	Iban	bone	15	644	tulaŋ	t u l a ŋ	852	
285	Berawan (Long Terawan)	bone	15	644	tulaŋ	t u l a ŋ	852	
286	Moken	bone	15	644	kəlaːn	k ə l aː n	852	
287	Hanunoo	bone	15	128	butʔul	b u t ʔ u l	852	
288	Wuna	bone	15	475	buku	b u k u	852	
289	Tetum	bone	15	778	ruʔin	r u ʔ i n	852	
290	Mailu	bone	15	1942	kisa	k i s a	233	
291	Tsou	bone	15	644	cʉ́ehʉ	c ʉ́ e h ʉ	418	
292	Nias	bone	15	-644	tõla	t õ l a	852	
293	Central Amis	bone	15	22	ukak	u k a k	852	
294	Central Amis	bone	15	22	okak	o k a k	852	
295	Central Amis	bone	15	22	ukak	u k a k	852	
296	Banoni	bone	15	2609	sipana	s i p a n a	852	
297	Singhi	bone	15	644	turaŋ	t u r a ŋ	852	
298	Banggi	bone	15	644	tulagn	t u l a g n	852	
299	Maloh	intestines	16	723	parut	p a r u t	826	
300	Merina (Malagasy)	intestines	16	524	tsinaj	t s i n a j	826	
301	Thao	intestines	16	1168	rumrum	r u m r u m	199	
302	Palauan	intestines	16	-524	delacʰ	d e l a cʰ	826	
303	Tunjung	intestines	16	-524	usiʔ#ŋaiʔ	u s i ʔ # ŋ a i ʔ	826	
304	Bare'e	intestines	16	1487	wajaː#ntaʔi	w a j aː # n t a ʔ i	882	
305	Iban	intestines	16	723	perut	p e r u t	826	
306	Berawan (Long Terawan)	intestines	16	524	tənaiʔ	t ə n a i ʔ	826	
307	Hanunoo	intestines	16	605	bitukaʔ	b i t u k a ʔ	826	
308	Hanunoo	intestines	16	605	punaʔ	p u n a ʔ	826	
309	Wuna	intestines	16	1861	ihi#no#tagʰi	i h i # n o # t a gʰ i	826	
310	Tetum	intestines	16	1884	te#oan	t e # o a n	826	
311	Mailu	intestines	16	524	sinae	s i n a e	826	
312	Tsou	intestines	16	2104	soeu	s o e u	675	
313	Nias	intestines	16	605	betuʔa	b e t u ʔ a	826	
314	Nias	intestines	16	605	riʔi	r i ʔ i	117	
315	Central Amis	intestines	16	524	tinaiq	t i n a i q	826	
316	Central Amis	intestines	16	524	tinaiʕ	t i n a i ʕ	826	
317	Banoni	intestines	16	333	kore	k o r e	306	
318	Maloh	liver	17	297	até	a t é	921	
319	Merina (Malagasy)	liver	17	297	atj	a t j	921	
320	Thao	liver	17	170	rishi	r i s h i	921	
321	Palauan	liver	17	-297	cʰad	cʰ a d	921	
322	Tunjung	liver	17	1406	limpa	l i m p a	665	
323	Bare'e	liver	17	297	ate	a t e	921	
324	Iban	liver	17	297	atau	a t a u	921	
325	Berawan (Long Terawan)	liver	17	297	ataj	a t a j	921	
326	Moken	liver	17	297	kataj	k a t a j	921	
327	Hanunoo	liver	17	297	ataj	a t a j	921	
328	Wuna	liver	17	297	gʰete	gʰ e t e	921	
329	Tetum	liver	17	297	aten	a t e n	921	
330	Mailu	liver	17	1943	arame	a r a m e	921	
331	Tsou	liver	17	2105	hʔonu	h ʔ o n u	348	
332	Nias	liver	17	297	ate	a t e	921	
333	Central Amis	liver	17	297	ataj	a t a j	921	
334	Central Amis	liver	17	297	ʕataj	ʕ a t a j	921	
335	Banoni	liver	17	297	date	d a t e	921	
336	Singhi	liver	17	297	atin	a t i n	921	
337	Banggi	liver	17	297	ati	a t i	921	
338	Maloh	breast	18	331	susu	s u s u	901	
339	Merina (Malagasy)	breast	18	205	nono	n o n o	901	
340	Thao	breast	18	331	tutu	t u t u	901	
341	Palauan	breast	18	331	tut	t u t	901	
342	Tunjung	breast	18	1407	tosoq	t o s o q	901	
343	Bare'e	breast	18	331	susu	s u s u	901	
344	Iban	breast	18	331	tusu	t u s u	901	
345	Berawan (Long Terawan)	breast	18	300	iteʔ	i t e ʔ	901	
346	Moken	breast	18	755	dadaʔ	d a d a ʔ	33	
347	Hanunoo	breast	18	331	susu	s u s u	901	
348	Wuna	breast	18	300	titi	t i t i	901	
349	Tetum	breast	18	331	susun	s u s u n	901	
350	Mailu	breast	18	1944	hama	h a m a	5	
351	Tsou	breast	18	205	nunʔu	n u n ʔ u	901	
352	Nias	breast	18	331	fosu	f o s u	901	
353	Nias	breast	18	331	susu	s u s u	901	
354	Central Amis	breast	18	2341	faluhaŋ	f a l u h a ŋ	492	
355	Central Amis	breast	18	2342	falohaŋ	f a l o h a ŋ	421	
356	Central Amis	breast	18	331	cucu	c u c u	901	
357	Chamorro	breast	18	331	susu	s u s u	901	
358	Banoni	breast	18	331	su	s u	901	
359	Banggi	breast	18	759	dudu	d u d u	901	
360	Maloh	shoulder	19	419	babaŋ	b a b a ŋ	1020	
361	Merina (Malagasy)	shoulder	19	1059	soroka	s o r o k a	537	
362	Thao	shoulder	19	102	qalhafa	q a l h a f a	1020	
363	Palauan	shoulder	19	1261	oŋeluŋel	o ŋ e l u ŋ e l	481	
364	Tunjung	shoulder	19	1408	bahuq	b a h u q	1020	
365	Bare'e	shoulder	19	102	awaː	a w aː	1020	
366	Iban	shoulder	19	295	bau	b a u	1020	
367	Berawan (Long Terawan)	shoulder	19	-102	bikih	b i k i h	1020	
368	Hanunoo	shoulder	19	1802	labaj	l a b a j	1020	
369	Wuna	shoulder	19	-102	gʰofea	gʰ o f e a	334	
370	Tetum	shoulder	19	-135	baːs	b aː s	1020	
371	Mailu	shoulder	19	1945	gabi	g a b i	480	
372	Tsou	shoulder	19	2106	eiʔsi	e i ʔ s i	759	
373	Nias	shoulder	19	2231	alisi	a l i s i	759	
374	Central Amis	shoulder	19	102	afala	a f a l a	1020	
375	Central Amis	shoulder	19	102	ʔafala	ʔ a f a l a	1020	
376	Chamorro	shoulder	19	102	apaga	a p a g a	1020	
377	Banoni	shoulder	19	2610	dzaneko	d z a n e k o	203	
378	Singhi	shoulder	19	781	papi	p a p i	480	
379	Banggi	shoulder	19	2846	owu	o w u	1020	
380	Maloh	to know, be knowledgeable	20	-137	tamu	t a m u	701	
381	Merina (Malagasy)	to know, be knowledgeable	20	1060	mahalala	m a h a l a l a	701	
382	Thao	to know, be knowledgeable	20	631	mafazaq	m a f a z a q	701	
383	Palauan	to know, be knowledgeable	20	1262	meducʰ	m e d u cʰ	701	
384	Tunjung	to know, be knowledgeable	20	1409	togaʔ	t o g a ʔ	420	
385	Bare'e	to know, be knowledgeable	20	1488	inca	i n c a	764	
386	Iban	to know, be knowledgeable	20	137	tauʔ	t a u ʔ	701	
387	Iban	to know, be knowledgeable	20	1559	temu	t e m u	701	
388	Berawan (Long Terawan)	to know, be knowledgeable	20	1634	ninʲon	n i nʲ o n	170	
389	Moken	to know, be knowledgeable	20	1708	nʲədan	nʲ ə d a n	701	
390	Hanunoo	to know, be knowledgeable	20	137	taʔu	t a ʔ u	701	
391	Wuna	to know, be knowledgeable	20	204	pandehao	p a n d e h a o	726	
392	Tetum	to know, be knowledgeable	20	655	hatana	h a t a n a	701	
393	Mailu	to know, be knowledgeable	20	793	ribariba	r i b a r i b a	598	
394	Mailu	to know, be knowledgeable	20	1946	vegarai	v e g a r a i	687	
395	Tsou	to know, be knowledgeable	20	271	bocʰio	b o cʰ i o	228	
396	Nias	to know, be knowledgeable	20	2232	ila	i l a	764	
397	Central Amis	to know, be knowledgeable	20	631	mafanaq	m a f a n a q	701	
398	Central Amis	to know, be knowledgeable	20	631	mafanaʔ	m a f a n a ʔ	701	
399	Banoni	to know, be knowledgeable	20	2611	kuki	k u k i	48	
400	Banoni	to know, be knowledgeable	20	2612	vonogu	v o n o g u	279	
401	Singhi	to know, be knowledgeable	20	2750	puan	p u a n	701	
402	Banggi	to know, be knowledgeable	20	2847	fandi	f a n d i	576	
403	Merina (Malagasy)	to think	21	1061	mihévitra	m i h é v i t r a	841	
404	Thao	to think	21	1169	maŋqtu	m a ŋ q t u	751	
405	Palauan	to think	21	1263	omdasu	o m d a s u	453	
406	Bare'e	to think	21	1489	monawa	m o n a w a	841	
407	Iban	to think	21	1560	rundiŋ	r u n d i ŋ	841	
408	Moken	to think	21	565	məkʰit	m ə kʰ i t	841	
409	Hanunoo	to think	21	565	umisip	u m i s i p	841	
410	Hanunoo	to think	21	565	magduman	m a g d u m a n	841	
411	Tetum	to think	21	500	hanoʔin	h a n o ʔ i n	841	
412	Mailu	to think	21	-752	sunaːvini	s u n aː v i n i	861	
413	Tsou	to think	21	2107	maʔmi	m a ʔ m i	575	
414	Nias	to think	21	2233	wai	w a i	386	
415	Central Amis	to think	21	2343	miharateŋ	m i h a r a t e ŋ	841	
416	Central Amis	to think	21	2344	miharateŋ	m i h a r a t e ŋ	841	
417	Chamorro	to think	21	2520	hasːo	h a sː o	841	
418	Banoni	to think	21	2613	varekana	v a r e k a n a	601	
419	Singhi	to think	21	2751	saka#ŋasuŋ	s a k a # ŋ a s u ŋ	841	
420	Maloh	to fear	22	787	takut	t a k u t	946	
421	Merina (Malagasy)	to fear	22	787	tahotra	t a h o t r a	946	
422	Thao	to fear	22	1170	shuŋkash	s h u ŋ k a s h	1016	
423	Palauan	to fear	22	787	dakt	d a k t	946	
424	Tunjung	to fear	22	1410	bihin	b i h i n	260	
425	Bare'e	to fear	22	330	maeka	m a e k a	946	
426	Iban	to fear	22	787	takut	t a k u t	946	
427	Berawan (Long Terawan)	to fear	22	1635	bikaʔ	b i k a ʔ	946	
428	Moken	to fear	22	1709	gajaːŋ	g a j aː ŋ	528	
429	Moken	to fear	22	-787	lakoːt	l a k oː t	946	
430	Hanunoo	to fear	22	1803	dalaʔ	d a l a ʔ	946	
431	Wuna	to fear	22	753	notehi	n o t e h i	946	
432	Tetum	to fear	22	787	hatauk	h a t a u k	946	
433	Mailu	to fear	22	-787	taguru	t a g u r u	946	
434	Tsou	to fear	22	2108	skoeu	s k o e u	204	
435	Nias	to fear	22	787	taʔu	t a ʔ u	946	
436	Central Amis	to fear	22	798	matalaw	m a t a l a w	946	
437	Chamorro	to fear	22	2521	kinibatde	k i n i b a t d e	595	
438	Banoni	to fear	22	2614	vere	v e r e	949	
439	Singhi	to fear	22	2752	toru	t o r u	946	
440	Banggi	to fear	22	2848	molok	m o l o k	946	
441	Maloh	blood	23	572	daraʔ	d a r a ʔ	955	
442	Merina (Malagasy)	blood	23	572	ra	r a	955	
443	Thao	blood	23	1171	talhum	t a l h u m	955	
444	Palauan	blood	23	1264	rasecʰ	r a s e cʰ	955	
445	Tunjung	blood	23	572	rahaʔ	r a h a ʔ	955	
446	Bare'e	blood	23	572	daː	d aː	955	
447	Iban	blood	23	572	darah	d a r a h	955	
448	Berawan (Long Terawan)	blood	23	346	səma	s ə m a	955	
449	Moken	blood	23	572	dalaːk	d a l aː k	955	
450	Hanunoo	blood	23	396	duguʔ	d u g u ʔ	955	
451	Wuna	blood	23	572	rea	r e a	955	
452	Tetum	blood	23	572	raːn	r aː n	955	
453	Mailu	blood	23	572	lala	l a l a	955	
454	Tsou	blood	23	2109	hmueu	h m u e u	944	
455	Nias	blood	23	572	do	d o	955	
456	Central Amis	blood	23	2345	remes	r e m e s	955	
457	Banoni	blood	23	2615	ŋatsi	ŋ a t s i	955	
458	Singhi	blood	23	572	doja	d o j a	955	
459	Banggi	blood	23	572	raːh	r aː h	955	
460	Maloh	head	24	442	ulu	u l u	746	
461	Merina (Malagasy)	head	24	1062	loha	l o h a	746	
462	Thao	head	24	552	punuq	p u n u q	746	
463	Palauan	head	24	1265	klidm	k l i d m	582	
464	Tunjung	head	24	438	kuhuŋ	k u h u ŋ	746	
465	Bare'e	head	24	1490	woʔo	w o ʔ o	180	
466	Berawan (Long Terawan)	head	24	442	uloh	u l o h	746	
467	Hanunoo	head	24	442	ulu	u l u	746	
468	Wuna	head	24	578	fotu	f o t u	746	
469	Tetum	head	24	442	ulun	u l u n	746	
470	Mailu	head	24	442	uru	u r u	746	
471	Mailu	head	24	442	moru	m o r u	746	
472	Tsou	head	24	530	fŋuu	f ŋ u u	191	
473	Nias	head	24	2234	hõgõ	h õ g õ	690	
474	Central Amis	head	24	516	taŋar	t a ŋ a r	355	
475	Central Amis	head	24	530	fuŋoh	f u ŋ o h	746	
476	Chamorro	head	24	442	ulu	u l u	746	
477	Banoni	head	24	2616	tope	t o p e	746	
478	Singhi	head	24	2753	bak	b a k	746	
479	Banggi	head	24	442	ulu	u l u	746	
480	Maloh	neck	25	1003	kaloŋ	k a l o ŋ	937	
481	Merina (Malagasy)	neck	25	1063	vozona	v o z o n a	937	
482	Thao	neck	25	1172	buqtur	b u q t u r	937	
483	Palauan	neck	25	1266	cʰikl	cʰ i k l	937	
484	Tunjung	neck	25	-544	lohoŋ	l o h o ŋ	937	
485	Bare'e	neck	25	1491	taŋgude	t a ŋ g u d e	965	
486	Iban	neck	25	1561	rekoŋ	r e k o ŋ	937	
487	Berawan (Long Terawan)	neck	25	-557	bitoʔ	b i t o ʔ	937	
488	Moken	neck	25	1710	tukʰoː	t u kʰ oː	937	
489	Moken	neck	25	421	buloːŋ	b u l oː ŋ	937	
490	Hanunoo	neck	25	220	liʔug	l i ʔ u g	937	
491	Wuna	neck	25	94	wugʰu	w u gʰ u	937	
492	Tetum	neck	25	-643	kakorok	k a k o r o k	937	
493	Mailu	neck	25	1947	kusani	k u s a n i	696	
494	Tsou	neck	25	2110	sʉ́nʉ	s ʉ́ n ʉ	368	
495	Nias	neck	25	2235	bagi	b a g i	132	
496	Central Amis	neck	25	220	liqer	l i q e r	937	
497	Central Amis	neck	25	220	liʕer	l i ʕ e r	937	
498	Banoni	neck	25	657	kokoromo	k o k o r o m o	937	
499	Singhi	neck	25	-325	tuŋoe	t u ŋ o e	937	
500	Banggi	neck	25	2849	tigoru	t i g o r u	937	
501	Maloh	hair	26	252	buk	b u k	727	
502	Merina (Malagasy)	hair	26	-126	volo	v o l o	727	
503	Thao	hair	26	252	fukish	f u k i s h	727	
504	Palauan	hair	26	-252	cʰui	cʰ u i	727	
505	Tunjung	hair	26	677	alaw	a l a w	727	
506	Bare'e	hair	26	-126	wujua	w u j u a	727	
507	Iban	hair	26	252	bok	b o k	727	
508	Berawan (Long Terawan)	hair	26	252	puʔ	p u ʔ	727	
509	Moken	hair	26	1711	buloj	b u l o j	727	
510	Hanunoo	hair	26	252	buhuk	b u h u k	727	
511	Wuna	hair	26	126	vulu#no#fotu	v u l u # n o # f o t u	727	
512	Tetum	hair	26	252	fuːk	f uː k	727	
513	Mailu	hair	26	441	limuː	l i m uː	262	
514	Tsou	hair	26	252	fʔʉ́sʉ	f ʔ ʉ́ s ʉ	360	
515	Nias	hair	26	252	bu	b u	727	
516	Central Amis	hair	26	252	fukes	f u k e s	727	
517	Chamorro	hair	26	126	gapotulu	g a p o t u l u	727	
518	Chamorro	hair	26	586	pulu	p u l u	727	
519	Banoni	hair	26	586	punu	p u n u	727	
520	Singhi	hair	26	252	boek	b o e k	727	
521	Banggi	hair	26	252	obuk	o b u k	727	
522	Maloh	nose	27	1004	iŋar	i ŋ a r	1021	
523	Merina (Malagasy)	nose	27	26	orona	o r o n a	1021	
524	Thao	nose	27	316	muzin	m u z i n	1021	
525	Palauan	nose	27	1267	iis	i i s	1021	
526	Tunjung	nose	27	26	uruŋ	u r u ŋ	1021	
527	Bare'e	nose	27	119	eŋo	e ŋ o	604	
528	Iban	nose	27	26	idoŋ	i d o ŋ	1021	
529	Berawan (Long Terawan)	nose	27	26	cuŋ	c u ŋ	1021	
530	Moken	nose	27	1712	cahuːŋ	c a h uː ŋ	1021	
