ID	Language	Gloss	GlossID	CogID	IPA	Tokens	NewCogID	
1	Maloh	hand	1	155	taŋan	t a ŋ a n	787	
2	Merina (Malagasy)	hand	1	155	tanana	t a n a n a	787	
3	Thao	hand	1	446	rima	r i m a	787	
4	Palauan	hand	1	446	cʰim	cʰ i m	787	
5	Tunjung	hand	1	155	aŋaʔ	a ŋ a ʔ	787	
6	Bare'e	hand	1	1484	pale	p a l e	787	
7	Iban	hand	1	155	taŋan	t a ŋ a n	787	
8	Iban	hand	1	1556	jari	j a r i	787	
9	Berawan (Long Terawan)	hand	1	481	tisu	t i s u	787	
10	Berawan (Long Terawan)	hand	1	481	isu	i s u	787	
11	Hanunoo	hand	1	1796	kamaŋ	k a m a ŋ	787	
12	Wuna	hand	1	446	lima	l i m a	787	
13	Tetum	hand	1	446	liman	l i m a n	787	
14	Mailu	hand	1	446	ima	i m a	787	
15	Tsou	hand	1	350	mucu	m u c u	412	
16	Nias	hand	1	155	taŋa	t a ŋ a	787	
17	Central Amis	hand	1	19	kamaj	k a m a j	787	
18	Chamorro	hand	1	2515	kanːai	k a nː a i	787	
19	Banoni	hand	1	446	numa	n u m a	787	
20	Singhi	hand	1	155	toŋan	t o ŋ a n	787	
21	Maloh	left	2	1000	kajoko	k a j o k o	631	
22	Merina (Malagasy)	left	2	-483	havia	h a v i a	631	
23	Palauan	left	2	1253	katur	k a t u r	631	
24	Tunjung	left	2	645	ulaj	u l a j	631	
25	Bare'e	left	2	483	kaiː	k a iː	523	
26	Iban	left	2	560	kibaʔ	k i b a ʔ	631	
27	Berawan (Long Terawan)	left	2	645	pəmaiŋ	p ə m a i ŋ	631	
28	Moken	left	2	1702	ʔeloj	ʔ e l o j	631	
29	Hanunoo	left	2	159	wala	w a l a	631	
30	Wuna	left	2	98	kema	k e m a	631	
31	Tetum	left	2	1881	karuk	k a r u k	631	
32	Mailu	left	2	1934	ebe	e b e	631	
33	Tsou	left	2	483	vrina	v r i n a	539	
34	Nias	left	2	2227	kabera	k a b e r a	631	
35	Central Amis	left	2	483	kawili	k a w i l i	631	
36	Chamorro	left	2	2516	akague	a k a g u e	631	
37	Banoni	left	2	2601	tororona	t o r o r o n a	631	
38	Singhi	left	2	2743	bait	b a i t	631	
39	Banggi	left	2	-159	kuikiwaŋ	k u i k i w a ŋ	393	
40	Maloh	right	3	-519	kato	k a t o	683	
41	Merina (Malagasy)	right	3	255	havanana	h a v a n a n a	683	
42	Palauan	right	3	1254	kadikm	k a d i k m	683	
43	Tunjung	right	3	519	tauʔ	t a u ʔ	683	
44	Bare'e	right	3	255	kana	k a n a	683	
45	Iban	right	3	255	kanan	k a n a n	683	
46	Berawan (Long Terawan)	right	3	519	pəŋkatuʔoh	p ə ŋ k a t u ʔ o h	683	
47	Moken	right	3	255	nanaːn	n a n aː n	683	
48	Hanunoo	right	3	-184	sikun	s i k u n	683	
49	Wuna	right	3	255	swana	s w a n a	683	
50	Tetum	right	3	255	kwana	k w a n a	683	
51	Mailu	right	3	1935	iata	i a t a	310	
52	Tsou	right	3	255	vhona	v h o n a	683	
53	Nias	right	3	2228	kawõlõ	k a w õ l õ	267	
54	Central Amis	right	3	255	kawanan	k a w a n a n	683	
55	Banoni	right	3	519	matoː	m a t oː	683	
56	Singhi	right	3	519	toux	t o u x	683	
57	Banggi	right	3	-184	kikuan	k i k u a n	683	
58	Merina (Malagasy)	leg/foot	4	-97	ranjo	r a n j o	882	
59	Merina (Malagasy)	leg/foot	4	1053	toŋotra	t o ŋ o t r a	888	
60	Thao	leg/foot	4	1161	kuskus	k u s k u s	882	
61	Palauan	leg/foot	4	-290	oacʰ	o a cʰ	882	
62	Tunjung	leg/foot	4	1401	uneŋ	u n e ŋ	882	
63	Bare'e	leg/foot	4	28	witi	w i t i	882	
64	Iban	leg/foot	4	290	kaki	k a k i	882	
65	Iban	leg/foot	4	1557	pah	p a h	882	
66	Berawan (Long Terawan)	leg/foot	4	366	gimaʔ	g i m a ʔ	882	
67	Moken	leg/foot	4	199	pakaʔ	p a k a ʔ	882	
68	Moken	leg/foot	4	290	kakaj	k a k a j	882	
69	Hanunoo	leg/foot	4	1797	raparapa	r a p a r a p a	882	
70	Wuna	leg/foot	4	290	gʰagʰe	gʰ a gʰ e	882	
71	Tetum	leg/foot	4	290	ain	a i n	882	
72	Mailu	leg/foot	4	1936	au	a u	882	
73	Tsou	leg/foot	4	2099	ruru	r u r u	165	
74	Nias	leg/foot	4	290	ahe	a h e	882	
75	Central Amis	leg/foot	4	290	waqaj	w a q a j	882	
76	Chamorro	leg/foot	4	2517	adːeŋ	a dː e ŋ	882	
77	Banoni	leg/foot	4	2602	rapinːa	r a p i nː a	349	
78	Singhi	leg/foot	4	2744	peun	p e u n	882	
79	Banggi	leg/foot	4	290	uei	u e i	882	
80	Maloh	to walk	5	563	lambaʔ	l a m b a ʔ	759	
81	Merina (Malagasy)	to walk	5	1054	mandéha	m a n d é h a	598	
82	Palauan	to walk	5	212	merael	m e r a e l	759	
83	Tunjung	to walk	5	212	calan	c a l a n	759	
84	Bare'e	to walk	5	99	linja	l i n j a	759	
85	Iban	to walk	5	212	jalai	j a l a i	759	
86	Berawan (Long Terawan)	to walk	5	57	lakaw	l a k a w	759	
87	Moken	to walk	5	57	lakaw	l a k a w	759	
88	Hanunoo	to walk	5	57	lumakaw	l u m a k a w	759	
89	Wuna	to walk	5	362	nokala	n o k a l a	759	
90	Tetum	to walk	5	57	laʔo	l a ʔ o	759	
91	Mailu	to walk	5	1937	baebae	b a e b a e	759	
92	Tsou	to walk	5	2100	coeconʉ	c o e c o n ʉ	800	
93	Nias	to walk	5	416	fanõ	f a n õ	759	
94	Central Amis	to walk	5	690	lumakat	l u m a k a t	759	
95	Central Amis	to walk	5	690	rumakat	r u m a k a t	759	
96	Chamorro	to walk	5	57	lahu	l a h u	759	
97	Singhi	to walk	5	416	ponu	p o n u	759	
98	Banggi	to walk	5	416	empaːno	e m p aː n o	759	
99	Maloh	road/path	6	95	dalan	d a l a n	601	
100	Merina (Malagasy)	road/path	6	95	lalana	l a l a n a	601	
101	Thao	road/path	6	95	saran	s a r a n	601	
102	Palauan	road/path	6	95	rael	r a e l	601	
103	Tunjung	road/path	6	95	loroŋ	l o r o ŋ	891	
104	Bare'e	road/path	6	95	jaja	j a j a	601	
105	Iban	road/path	6	95	jalai	j a l a i	601	
106	Berawan (Long Terawan)	road/path	6	95	ilan	i l a n	601	
107	Hanunoo	road/path	6	95	dalan	d a l a n	601	
108	Wuna	road/path	6	95	sala	s a l a	601	
109	Tetum	road/path	6	95	dalan	d a l a n	601	
110	Mailu	road/path	6	1938	laea	l a e a	601	
111	Tsou	road/path	6	95	ceonʉ	c e o n ʉ	601	
112	Nias	road/path	6	95	lala	l a l a	601	
113	Central Amis	road/path	6	95	lalan	l a l a n	601	
114	Chamorro	road/path	6	95	cʰalan	cʰ a l a n	601	
115	Banoni	road/path	6	95	sanana	s a n a n a	601	
116	Singhi	road/path	6	95	aran	a r a n	601	
117	Maloh	to come	7	1001	mondok	m o n d o k	796	
118	Merina (Malagasy)	to come	7	154	avj	a v j	796	
119	Merina (Malagasy)	to come	7	1055	toŋa	t o ŋ a	499	
120	Thao	to come	7	1162	munaj	m u n a j	796	
121	Palauan	to come	7	719	méi	m é i	796	
122	Tunjung	to come	7	1402	moːt	m oː t	796	
123	Bare'e	to come	7	719	maʔi	m a ʔ i	796	
124	Iban	to come	7	-561	datai	d a t a i	796	
125	Berawan (Long Terawan)	to come	7	1631	liʔ	l i ʔ	796	
126	Moken	to come	7	1703	ŋadin	ŋ a d i n	33	
127	Hanunoo	to come	7	1798	balik	b a l i k	796	
128	Wuna	to come	7	719	mai	m a i	796	
129	Tetum	to come	7	719	mai	m a i	796	
130	Mailu	to come	7	-719	ai	a i	796	
131	Tsou	to come	7	3	oh	o h	796	
132	Tsou	to come	7	3	uso	u s o	796	
133	Nias	to come	7	719	mõi	m õ i	796	
134	Central Amis	to come	7	2334	tajni	t a j n i	796	
135	Singhi	to come	7	2745	nug	n u g	796	
136	Banggi	to come	7	2845	miaːtaŋ	m i aː t a ŋ	796	
137	Maloh	to turn	8	1002	lempaŋ	l e m p a ŋ	821	
138	Merina (Malagasy)	to turn	8	-367	vilj	v i l j	821	
139	Thao	to turn	8	1163	taushuqish	t a u s h u q i s h	821	
140	Palauan	to turn	8	1255	meŋesoim	m e ŋ e s o i m	8	
141	Tunjung	to turn	8	1403	nencaŋ	n e n c a ŋ	821	
142	Bare'e	to turn	8	591	gili	g i l i	821	
143	Iban	to turn	8	431	bilok	b i l o k	821	
144	Berawan (Long Terawan)	to turn	8	1632	ŋəlibiʔ	ŋ ə l i b i ʔ	117	
145	Moken	to turn	8	1704	nʲiliək	nʲ i l i ə k	821	
146	Hanunoo	to turn	8	1799	simaŋ	s i m a ŋ	821	
147	Wuna	to turn	8	1860	nobelo	n o b e l o	821	
148	Tetum	to turn	8	-367	filas	f i l a s	821	
149	Tetum	to turn	8	-367	fila	f i l a	821	
150	Tetum	to turn	8	-367	faur	f a u r	821	
151	Tsou	to turn	8	2101	miunu	m i u n u	578	
152	Central Amis	to turn	8	2335	maliwuŋ	m a l i w u ŋ	821	
153	Banoni	to turn	8	2603	beruː	b e r uː	38	
154	Banoni	to turn	8	2604	vegom	v e g o m	848	
155	Singhi	to turn	8	2746	kus	k u s	821	
156	Maloh	to swim	9	-311	arananaŋ	a r a n a n a ŋ	806	
157	Merina (Malagasy)	to swim	9	543	lomano	l o m a n o	806	
158	Merina (Malagasy)	to swim	9	1056	milomano	m i l o m a n o	806	
159	Thao	to swim	9	1164	mrauz	m r a u z	806	
160	Palauan	to swim	9	1256	meŋedub	m e ŋ e d u b	806	
161	Tunjung	to swim	9	543	karaŋoj	k a r a ŋ o j	806	
162	Bare'e	to swim	9	543	naŋu	n a ŋ u	806	
163	Iban	to swim	9	1558	njemerai	n j e m e r a i	806	
164	Berawan (Long Terawan)	to swim	9	543	pəloŋoj	p ə l o ŋ o j	806	
165	Moken	to swim	9	543	naŋoj	n a ŋ o j	806	
166	Hanunoo	to swim	9	543	lumaŋuj	l u m a ŋ u j	806	
167	Wuna	to swim	9	543	leni	l e n i	806	
168	Tetum	to swim	9	543	nani	n a n i	806	
169	Mailu	to swim	9	540	loroloro	l o r o l o r o	468	
170	Mailu	to swim	9	540	rolorolo	r o l o r o l o	646	
171	Tsou	to swim	9	543	euhuŋzu	e u h u ŋ z u	604	
172	Nias	to swim	9	543	molaŋi	m o l a ŋ i	806	
173	Central Amis	to swim	9	543	laŋuj	l a ŋ u j	806	
174	Central Amis	to swim	9	543	milaŋuj	m i l a ŋ u j	806	
175	Chamorro	to swim	9	543	naŋunʲaŋu	n a ŋ u nʲ a ŋ u	806	
176	Banoni	to swim	9	789	suː	s uː	424	
177	Singhi	to swim	9	543	naŋuj	n a ŋ u j	806	
178	Merina (Malagasy)	dirty	10	242	maloto	m a l o t o	929	
179	Thao	dirty	10	1165	marisrisin	m a r i s r i s i n	929	
180	Palauan	dirty	10	1257	idokel	i d o k e l	90	
181	Tunjung	dirty	10	242	marotaʔ	m a r o t a ʔ	929	
182	Bare'e	dirty	10	1485	sapa	s a p a	929	
183	Iban	dirty	10	667	kamah	k a m a h	929	
184	Berawan (Long Terawan)	dirty	10	1633	labih	l a b i h	929	
185	Moken	dirty	10	1705	caʔiək	c a ʔ i ə k	929	
186	Hanunoo	dirty	10	423	majagtiŋ	m a j a g t i ŋ	929	
187	Hanunoo	dirty	10	423	maʔuriŋ	m a ʔ u r i ŋ	929	
188	Wuna	dirty	10	785	noraku	n o r a k u	929	
189	Tetum	dirty	10	1882	kfur	k f u r	929	
190	Tetum	dirty	10	1883	karebo	k a r e b o	285	
191	Mailu	dirty	10	335	milomilo	m i l o m i l o	101	
192	Tsou	dirty	10	79	cai	c a i	929	
193	Tsou	dirty	10	79	caʔi	c a ʔ i	929	
194	Nias	dirty	10	-401	moŋdaʔi	m o ŋ d a ʔ i	569	
195	Central Amis	dirty	10	2336	maacek	m a a c e k	929	
196	Central Amis	dirty	10	2337	makalit	m a k a l i t	929	
197	Chamorro	dirty	10	2518	hoplat	h o p l a t	701	
198	Banoni	dirty	10	2605	kiːpi	k iː p i	929	
199	Singhi	dirty	10	2747	kais	k a i s	929	
200	Singhi	dirty	10	2748	sirida	s i r i d a	114	
201	Banggi	dirty	10	567	damak	d a m a k	929	
202	Merina (Malagasy)	dust	11	1057	vovoka	v o v o k a	846	
203	Bare'e	dust	11	182	awu	a w u	846	
204	Iban	dust	11	703	abu	a b u	846	
205	Iban	dust	11	182	apok	a p o k	846	
206	Berawan (Long Terawan)	dust	11	182	apoʔ	a p o ʔ	846	
207	Moken	dust	11	703	kaboj	k a b o j	846	
208	Hanunoo	dust	11	182	gabuk	g a b u k	846	
209	Hanunoo	dust	11	182	pukapuk	p u k a p u k	846	
210	Tetum	dust	11	-182	rai#ahun	r a i # a h u n	846	
211	Mailu	dust	11	1939	veve	v e v e	885	
212	Central Amis	dust	11	2338	taʔfod	t a ʔ f o d	846	
213	Banoni	dust	11	2606	ramuta	r a m u t a	846	
214	Singhi	dust	11	182	abux	a b u x	846	
215	Singhi	dust	11	182	sapok	s a p o k	846	
216	Banggi	dust	11	-182	auː	a uː	846	
217	Maloh	skin	12	216	kulit	k u l i t	774	
218	Merina (Malagasy)	skin	12	-216	hoditra	h o d i t r a	774	
219	Thao	skin	12	1166	shapa	s h a p a	774	
220	Palauan	skin	12	1258	budél	b u d é l	774	
221	Tunjung	skin	12	216	kulit	k u l i t	774	
222	Bare'e	skin	12	1486	pela	p e l a	774	
223	Iban	skin	12	216	kulit	k u l i t	774	
224	Berawan (Long Terawan)	skin	12	216	kulaiʔ	k u l a i ʔ	774	
225	Moken	skin	12	1706	bulaŋ	b u l a ŋ	774	
226	Hanunoo	skin	12	428	tarip	t a r i p	774	
227	Hanunoo	skin	12	1800	lukub	l u k u b	774	
228	Wuna	skin	12	216	kuli	k u l i	774	
229	Tetum	skin	12	216	kulit	k u l i t	774	
230	Mailu	skin	12	768	opi	o p i	713	
231	Tsou	skin	12	2102	snʉ́fʉ	s n ʉ́ f ʉ	432	
232	Nias	skin	12	216	uli	u l i	774	
233	Central Amis	skin	12	835	faŋes	f a ŋ e s	774	
234	Central Amis	skin	12	835	faŋes	f a ŋ e s	774	
235	Chamorro	skin	12	2519	lasːas	l a sː a s	774	
236	Banoni	skin	12	2607	kabunu	k a b u n u	713	
237	Singhi	skin	12	216	kurit	k u r i t	774	
238	Banggi	skin	12	-216	kubal	k u b a l	774	
239	Maloh	back	13	838	balakaŋ	b a l a k a ŋ	718	
240	Thao	back	13	832	rikus	r i k u s	718	
241	Palauan	back	13	1259	uulk	u u l k	718	
242	Tunjung	back	13	621	puŋuŋ	p u ŋ u ŋ	718	
243	Bare'e	back	13	832	taliku	t a l i k u	718	
244	Iban	back	13	838	belakaŋ	b e l a k a ŋ	718	
245	Berawan (Long Terawan)	back	13	832	likon	l i k o n	718	
246	Moken	back	13	832	lekoːt	l e k oː t	718	
247	Hanunoo	back	13	1801	daju	d a j u	688	
248	Tetum	back	13	111	kotːuk	k o tː u k	688	
249	Mailu	back	13	-157	deniabo	d e n i a b o	205	
250	Mailu	back	13	1940	doe	d o e	718	
251	Tsou	back	13	348	fʔuhu	f ʔ u h u	718	
252	Nias	back	13	2229	hulu	h u l u	718	
253	Central Amis	back	13	2339	kulur	k u l u r	718	
254	Central Amis	back	13	2340	koror	k o r o r	718	
255	Banoni	back	13	2608	tsugʰi	t s u gʰ i	688	
256	Singhi	back	13	2749	dug	d u g	688	
257	Maloh	belly	14	146	bataŋ	b a t a ŋ	918	
258	Merina (Malagasy)	belly	14	1058	kibo	k i b o	918	
259	Thao	belly	14	17	tiaz	t i a z	918	
260	Palauan	belly	14	-17	diil	d i i l	918	
261	Tunjung	belly	14	1404	naiʔ	n a i ʔ	918	
262	Bare'e	belly	14	249	kompo	k o m p o	918	
263	Iban	belly	14	840	perut	p e r u t	918	
264	Berawan (Long Terawan)	belly	14	17	tijan	t i j a n	918	
265	Moken	belly	14	1707	lakeʔ	l a k e ʔ	918	
266	Hanunoo	belly	14	17	tijan	t i j a n	918	
267	Wuna	belly	14	76	tagʰi	t a gʰ i	918	
268	Tetum	belly	14	-249	kabun	k a b u n	918	
269	Mailu	belly	14	1941	amara	a m a r a	918	
270	Tsou	belly	14	2103	bʉeo	b ʉ e o	540	
271	Nias	belly	14	2230	talu	t a l u	918	
272	Central Amis	belly	14	17	tial	t i a l	918	
273	Central Amis	belly	14	17	tial	t i a l	918	
274	Chamorro	belly	14	17	tujan	t u j a n	918	
275	Banoni	belly	14	-674	kobi	k o b i	64	
276	Singhi	belly	14	17	tain	t a i n	918	
277	Banggi	belly	14	17	tiagn	t i a g n	918	
278	Maloh	bone	15	644	tulaŋ	t u l a ŋ	762	
279	Merina (Malagasy)	bone	15	644	taolana	t a o l a n a	762	
280	Thao	bone	15	1167	puqu	p u q u	762	
281	Palauan	bone	15	1260	cʰiuis	cʰ i u i s	762	
282	Tunjung	bone	15	1405	lah	l a h	762	
283	Bare'e	bone	15	475	wuku	w u k u	762	
284	Iban	bone	15	644	tulaŋ	t u l a ŋ	762	
285	Berawan (Long Terawan)	bone	15	644	tulaŋ	t u l a ŋ	762	
286	Moken	bone	15	644	kəlaːn	k ə l aː n	762	
287	Hanunoo	bone	15	128	butʔul	b u t ʔ u l	762	
288	Wuna	bone	15	475	buku	b u k u	762	
289	Tetum	bone	15	778	ruʔin	r u ʔ i n	762	
290	Mailu	bone	15	1942	kisa	k i s a	209	
291	Tsou	bone	15	644	cʉ́ehʉ	c ʉ́ e h ʉ	370	
292	Nias	bone	15	-644	tõla	t õ l a	762	
293	Central Amis	bone	15	22	ukak	u k a k	762	
294	Central Amis	bone	15	22	okak	o k a k	762	
295	Central Amis	bone	15	22	ukak	u k a k	762	
296	Banoni	bone	15	2609	sipana	s i p a n a	762	
297	Singhi	bone	15	644	turaŋ	t u r a ŋ	762	
298	Banggi	bone	15	644	tulagn	t u l a g n	762	
299	Maloh	intestines	16	723	parut	p a r u t	737	
300	Merina (Malagasy)	intestines	16	524	tsinaj	t s i n a j	737	
301	Thao	intestines	16	1168	rumrum	r u m r u m	177	
302	Palauan	intestines	16	-524	delacʰ	d e l a cʰ	737	
303	Tunjung	intestines	16	-524	usiʔ#ŋaiʔ	u s i ʔ # ŋ a i ʔ	737	
304	Bare'e	intestines	16	1487	wajaː#ntaʔi	w a j aː # n t a ʔ i	788	
305	Iban	intestines	16	723	perut	p e r u t	737	
306	Berawan (Long Terawan)	intestines	16	524	tənaiʔ	t ə n a i ʔ	737	
307	Hanunoo	intestines	16	605	bitukaʔ	b i t u k a ʔ	737	
308	Hanunoo	intestines	16	605	punaʔ	p u n a ʔ	737	
309	Wuna	intestines	16	1861	ihi#no#tagʰi	i h i # n o # t a gʰ i	737	
310	Tetum	intestines	16	1884	te#oan	t e # o a n	737	
311	Mailu	intestines	16	524	sinae	s i n a e	737	
312	Tsou	intestines	16	2104	soeu	s o e u	599	
313	Nias	intestines	16	605	betuʔa	b e t u ʔ a	737	
314	Nias	intestines	16	605	riʔi	r i ʔ i	106	
315	Central Amis	intestines	16	524	tinaiq	t i n a i q	737	
316	Central Amis	intestines	16	524	tinaiʕ	t i n a i ʕ	737	
317	Banoni	intestines	16	333	kore	k o r e	737	
318	Maloh	liver	17	297	até	a t é	826	
319	Merina (Malagasy)	liver	17	297	atj	a t j	826	
320	Thao	liver	17	170	rishi	r i s h i	826	
321	Palauan	liver	17	-297	cʰad	cʰ a d	826	
322	Tunjung	liver	17	1406	limpa	l i m p a	590	
323	Bare'e	liver	17	297	ate	a t e	826	
324	Iban	liver	17	297	atau	a t a u	826	
325	Berawan (Long Terawan)	liver	17	297	ataj	a t a j	826	
326	Moken	liver	17	297	kataj	k a t a j	826	
327	Hanunoo	liver	17	297	ataj	a t a j	826	
328	Wuna	liver	17	297	gʰete	gʰ e t e	826	
329	Tetum	liver	17	297	aten	a t e n	826	
330	Mailu	liver	17	1943	arame	a r a m e	826	
331	Tsou	liver	17	2105	hʔonu	h ʔ o n u	311	
332	Nias	liver	17	297	ate	a t e	826	
333	Central Amis	liver	17	297	ataj	a t a j	826	
334	Central Amis	liver	17	297	ʕataj	ʕ a t a j	826	
335	Banoni	liver	17	297	date	d a t e	826	
336	Singhi	liver	17	297	atin	a t i n	826	
337	Banggi	liver	17	297	ati	a t i	826	
338	Maloh	breast	18	331	susu	s u s u	807	
339	Merina (Malagasy)	breast	18	205	nono	n o n o	807	
340	Thao	breast	18	331	tutu	t u t u	807	
341	Palauan	breast	18	331	tut	t u t	807	
342	Tunjung	breast	18	1407	tosoq	t o s o q	807	
343	Bare'e	breast	18	331	susu	s u s u	807	
344	Iban	breast	18	331	tusu	t u s u	807	
345	Berawan (Long Terawan)	breast	18	300	iteʔ	i t e ʔ	807	
346	Moken	breast	18	755	dadaʔ	d a d a ʔ	29	
347	Hanunoo	breast	18	331	susu	s u s u	807	
348	Wuna	breast	18	300	titi	t i t i	807	
349	Tetum	breast	18	331	susun	s u s u n	807	
350	Mailu	breast	18	1944	hama	h a m a	5	
351	Tsou	breast	18	205	nunʔu	n u n ʔ u	807	
352	Nias	breast	18	331	fosu	f o s u	807	
353	Nias	breast	18	331	susu	s u s u	807	
354	Central Amis	breast	18	2341	faluhaŋ	f a l u h a ŋ	434	
355	Central Amis	breast	18	2342	falohaŋ	f a l o h a ŋ	372	
356	Central Amis	breast	18	331	cucu	c u c u	807	
357	Chamorro	breast	18	331	susu	s u s u	807	
358	Banoni	breast	18	331	su	s u	807	
359	Banggi	breast	18	759	dudu	d u d u	807	
360	Maloh	shoulder	19	419	babaŋ	b a b a ŋ	923	
361	Merina (Malagasy)	shoulder	19	1059	soroka	s o r o k a	473	
362	Thao	shoulder	19	102	qalhafa	q a l h a f a	923	
363	Palauan	shoulder	19	1261	oŋeluŋel	o ŋ e l u ŋ e l	427	
364	Tunjung	shoulder	19	1408	bahuq	b a h u q	923	
365	Bare'e	shoulder	19	102	awaː	a w aː	923	
366	Iban	shoulder	19	295	bau	b a u	923	
367	Berawan (Long Terawan)	shoulder	19	-102	bikih	b i k i h	923	
368	Hanunoo	shoulder	19	1802	labaj	l a b a j	923	
369	Wuna	shoulder	19	-102	gʰofea	gʰ o f e a	298	
370	Tetum	shoulder	19	-135	baːs	b aː s	923	
371	Mailu	shoulder	19	1945	gabi	g a b i	426	
372	Tsou	shoulder	19	2106	eiʔsi	e i ʔ s i	673	
373	Nias	shoulder	19	2231	alisi	a l i s i	673	
374	Central Amis	shoulder	19	102	afala	a f a l a	923	
375	Central Amis	shoulder	19	102	ʔafala	ʔ a f a l a	923	
376	Chamorro	shoulder	19	102	apaga	a p a g a	923	
377	Banoni	shoulder	19	2610	dzaneko	d z a n e k o	181	
378	Singhi	shoulder	19	781	papi	p a p i	426	
379	Banggi	shoulder	19	2846	owu	o w u	923	
380	Maloh	to know, be knowledgeable	20	-137	tamu	t a m u	621	
381	Merina (Malagasy)	to know, be knowledgeable	20	1060	mahalala	m a h a l a l a	621	
382	Thao	to know, be knowledgeable	20	631	mafazaq	m a f a z a q	621	
383	Palauan	to know, be knowledgeable	20	1262	meducʰ	m e d u cʰ	621	
384	Tunjung	to know, be knowledgeable	20	1409	togaʔ	t o g a ʔ	621	
385	Bare'e	to know, be knowledgeable	20	1488	inca	i n c a	678	
386	Iban	to know, be knowledgeable	20	137	tauʔ	t a u ʔ	621	
387	Iban	to know, be knowledgeable	20	1559	temu	t e m u	621	
388	Berawan (Long Terawan)	to know, be knowledgeable	20	1634	ninʲon	n i nʲ o n	154	
389	Moken	to know, be knowledgeable	20	1708	nʲədan	nʲ ə d a n	621	
390	Hanunoo	to know, be knowledgeable	20	137	taʔu	t a ʔ u	621	
391	Wuna	to know, be knowledgeable	20	204	pandehao	p a n d e h a o	643	
392	Tetum	to know, be knowledgeable	20	655	hatana	h a t a n a	621	
393	Mailu	to know, be knowledgeable	20	793	ribariba	r i b a r i b a	529	
394	Mailu	to know, be knowledgeable	20	1946	vegarai	v e g a r a i	609	
395	Tsou	to know, be knowledgeable	20	271	bocʰio	b o cʰ i o	204	
396	Nias	to know, be knowledgeable	20	2232	ila	i l a	678	
397	Central Amis	to know, be knowledgeable	20	631	mafanaq	m a f a n a q	621	
398	Central Amis	to know, be knowledgeable	20	631	mafanaʔ	m a f a n a ʔ	621	
399	Banoni	to know, be knowledgeable	20	2611	kuki	k u k i	43	
400	Banoni	to know, be knowledgeable	20	2612	vonogu	v o n o g u	250	
401	Singhi	to know, be knowledgeable	20	2750	puan	p u a n	621	
402	Banggi	to know, be knowledgeable	20	2847	fandi	f a n d i	509	
403	Merina (Malagasy)	to think	21	1061	mihévitra	m i h é v i t r a	752	
404	Thao	to think	21	1169	maŋqtu	m a ŋ q t u	666	
405	Palauan	to think	21	1263	omdasu	o m d a s u	752	
406	Bare'e	to think	21	1489	monawa	m o n a w a	752	
407	Iban	to think	21	1560	rundiŋ	r u n d i ŋ	752	
408	Moken	to think	21	565	məkʰit	m ə kʰ i t	752	
409	Hanunoo	to think	21	565	umisip	u m i s i p	752	
410	Hanunoo	to think	21	565	magduman	m a g d u m a n	752	
411	Tetum	to think	21	500	hanoʔin	h a n o ʔ i n	752	
412	Mailu	to think	21	-752	sunaːvini	s u n aː v i n i	770	
413	Tsou	to think	21	2107	maʔmi	m a ʔ m i	508	
414	Nias	to think	21	2233	wai	w a i	344	
415	Central Amis	to think	21	2343	miharateŋ	m i h a r a t e ŋ	752	
416	Central Amis	to think	21	2344	miharateŋ	m i h a r a t e ŋ	752	
417	Chamorro	to think	21	2520	hasːo	h a sː o	752	
418	Banoni	to think	21	2613	varekana	v a r e k a n a	532	
419	Singhi	to think	21	2751	saka#ŋasuŋ	s a k a # ŋ a s u ŋ	752	
420	Maloh	to fear	22	787	takut	t a k u t	851	
421	Merina (Malagasy)	to fear	22	787	tahotra	t a h o t r a	851	
422	Thao	to fear	22	1170	shuŋkash	s h u ŋ k a s h	919	
423	Palauan	to fear	22	787	dakt	d a k t	851	
424	Tunjung	to fear	22	1410	bihin	b i h i n	233	
425	Bare'e	to fear	22	330	maeka	m a e k a	851	
426	Iban	to fear	22	787	takut	t a k u t	851	
427	Berawan (Long Terawan)	to fear	22	1635	bikaʔ	b i k a ʔ	851	
428	Moken	to fear	22	1709	gajaːŋ	g a j aː ŋ	464	
429	Moken	to fear	22	-787	lakoːt	l a k oː t	851	
430	Hanunoo	to fear	22	1803	dalaʔ	d a l a ʔ	851	
431	Wuna	to fear	22	753	notehi	n o t e h i	851	
432	Tetum	to fear	22	787	hatauk	h a t a u k	851	
433	Mailu	to fear	22	-787	taguru	t a g u r u	851	
434	Tsou	to fear	22	2108	skoeu	s k o e u	182	
435	Nias	to fear	22	787	taʔu	t a ʔ u	851	
436	Central Amis	to fear	22	798	matalaw	m a t a l a w	851	
437	Chamorro	to fear	22	2521	kinibatde	k i n i b a t d e	526	
438	Banoni	to fear	22	2614	vere	v e r e	854	
439	Singhi	to fear	22	2752	toru	t o r u	851	
440	Banggi	to fear	22	2848	molok	m o l o k	851	
441	Maloh	blood	23	572	daraʔ	d a r a ʔ	860	
442	Merina (Malagasy)	blood	23	572	ra	r a	860	
443	Thao	blood	23	1171	talhum	t a l h u m	860	
444	Palauan	blood	23	1264	rasecʰ	r a s e cʰ	860	
445	Tunjung	blood	23	572	rahaʔ	r a h a ʔ	860	
446	Bare'e	blood	23	572	daː	d aː	860	
447	Iban	blood	23	572	darah	d a r a h	860	
448	Berawan (Long Terawan)	blood	23	346	səma	s ə m a	860	
449	Moken	blood	23	572	dalaːk	d a l aː k	860	
450	Hanunoo	blood	23	396	duguʔ	d u g u ʔ	860	
451	Wuna	blood	23	572	rea	r e a	860	
452	Tetum	blood	23	572	raːn	r aː n	860	
453	Mailu	blood	23	572	lala	l a l a	860	
454	Tsou	blood	23	2109	hmueu	h m u e u	849	
455	Nias	blood	23	572	do	d o	860	
456	Central Amis	blood	23	2345	remes	r e m e s	860	
457	Banoni	blood	23	2615	ŋatsi	ŋ a t s i	860	
458	Singhi	blood	23	572	doja	d o j a	860	
459	Banggi	blood	23	572	raːh	r aː h	860	
460	Maloh	head	24	442	ulu	u l u	661	
461	Merina (Malagasy)	head	24	1062	loha	l o h a	661	
462	Thao	head	24	552	punuq	p u n u q	661	
463	Palauan	head	24	1265	klidm	k l i d m	661	
464	Tunjung	head	24	438	kuhuŋ	k u h u ŋ	661	
465	Bare'e	head	24	1490	woʔo	w o ʔ o	661	
466	Berawan (Long Terawan)	head	24	442	uloh	u l o h	661	
467	Hanunoo	head	24	442	ulu	u l u	661	
468	Wuna	head	24	578	fotu	f o t u	661	
469	Tetum	head	24	442	ulun	u l u n	661	
470	Mailu	head	24	442	uru	u r u	661	
471	Mailu	head	24	442	moru	m o r u	661	
472	Tsou	head	24	530	fŋuu	f ŋ u u	170	
473	Nias	head	24	2234	hõgõ	h õ g õ	612	
474	Central Amis	head	24	516	taŋar	t a ŋ a r	317	
475	Central Amis	head	24	530	fuŋoh	f u ŋ o h	661	
476	Chamorro	head	24	442	ulu	u l u	661	
477	Banoni	head	24	2616	tope	t o p e	661	
478	Singhi	head	24	2753	bak	b a k	661	
479	Banggi	head	24	442	ulu	u l u	661	
480	Maloh	neck	25	1003	kaloŋ	k a l o ŋ	842	
481	Merina (Malagasy)	neck	25	1063	vozona	v o z o n a	842	
482	Thao	neck	25	1172	buqtur	b u q t u r	842	
483	Palauan	neck	25	1266	cʰikl	cʰ i k l	842	
484	Tunjung	neck	25	-544	lohoŋ	l o h o ŋ	842	
485	Bare'e	neck	25	1491	taŋgude	t a ŋ g u d e	870	
486	Iban	neck	25	1561	rekoŋ	r e k o ŋ	842	
487	Berawan (Long Terawan)	neck	25	-557	bitoʔ	b i t o ʔ	842	
488	Moken	neck	25	1710	tukʰoː	t u kʰ oː	842	
489	Moken	neck	25	421	buloːŋ	b u l oː ŋ	842	
490	Hanunoo	neck	25	220	liʔug	l i ʔ u g	842	
491	Wuna	neck	25	94	wugʰu	w u gʰ u	842	
492	Tetum	neck	25	-643	kakorok	k a k o r o k	842	
493	Mailu	neck	25	1947	kusani	k u s a n i	616	
494	Tsou	neck	25	2110	sʉ́nʉ	s ʉ́ n ʉ	329	
495	Nias	neck	25	2235	bagi	b a g i	842	
496	Central Amis	neck	25	220	liqer	l i q e r	842	
497	Central Amis	neck	25	220	liʕer	l i ʕ e r	842	
498	Banoni	neck	25	657	kokoromo	k o k o r o m o	842	
499	Singhi	neck	25	-325	tuŋoe	t u ŋ o e	842	
500	Banggi	neck	25	2849	tigoru	t i g o r u	842	
501	Maloh	hair	26	252	buk	b u k	644	
502	Merina (Malagasy)	hair	26	-126	volo	v o l o	644	
503	Thao	hair	26	252	fukish	f u k i s h	644	
504	Palauan	hair	26	-252	cʰui	cʰ u i	644	
505	Tunjung	hair	26	677	alaw	a l a w	644	
506	Bare'e	hair	26	-126	wujua	w u j u a	644	
507	Iban	hair	26	252	bok	b o k	644	
508	Berawan (Long Terawan)	hair	26	252	puʔ	p u ʔ	644	
509	Moken	hair	26	1711	buloj	b u l o j	644	
510	Hanunoo	hair	26	252	buhuk	b u h u k	644	
511	Wuna	hair	26	126	vulu#no#fotu	v u l u # n o # f o t u	644	
512	Tetum	hair	26	252	fuːk	f uː k	644	
513	Mailu	hair	26	441	limuː	l i m uː	235	
514	Tsou	hair	26	252	fʔʉ́sʉ	f ʔ ʉ́ s ʉ	322	
515	Nias	hair	26	252	bu	b u	644	
516	Central Amis	hair	26	252	fukes	f u k e s	644	
517	Chamorro	hair	26	126	gapotulu	g a p o t u l u	644	
518	Chamorro	hair	26	586	pulu	p u l u	644	
519	Banoni	hair	26	586	punu	p u n u	644	
520	Singhi	hair	26	252	boek	b o e k	644	
521	Banggi	hair	26	252	obuk	o b u k	644	
522	Maloh	nose	27	1004	iŋar	i ŋ a r	924	
523	Merina (Malagasy)	nose	27	26	orona	o r o n a	924	
524	Thao	nose	27	316	muzin	m u z i n	924	
525	Palauan	nose	27	1267	iis	i i s	924	
526	Tunjung	nose	27	26	uruŋ	u r u ŋ	924	
527	Bare'e	nose	27	119	eŋo	e ŋ o	924	
528	Iban	nose	27	26	idoŋ	i d o ŋ	924	
529	Berawan (Long Terawan)	nose	27	26	cuŋ	c u ŋ	924	
530	Moken	nose	27	1712	cahuːŋ	c a h uː ŋ	924	
531	Moken	nose	27	-26	joŋ	j o ŋ	924	
