ID	Language	Gloss	GlossID	CogID	IPA	Tokens	NewCogID	
1	Maloh	hand	1	155	taŋan	t a ŋ a n	1050	
2	Merina (Malagasy)	hand	1	155	tanana	t a n a n a	1050	
3	Thao	hand	1	446	rima	r i m a	1050	
4	Palauan	hand	1	446	cʰim	cʰ i m	1050	
5	Tunjung	hand	1	155	aŋaʔ	a ŋ a ʔ	1050	
6	Bare'e	hand	1	1484	pale	p a l e	1050	
7	Iban	hand	1	155	taŋan	t a ŋ a n	1050	
8	Iban	hand	1	1556	jari	j a r i	32	
9	Berawan (Long Terawan)	hand	1	481	tisu	t i s u	1050	
10	Berawan (Long Terawan)	hand	1	481	isu	i s u	390	
11	Hanunoo	hand	1	1796	kamaŋ	k a m a ŋ	1050	
12	Wuna	hand	1	446	lima	l i m a	1050	
13	Tetum	hand	1	446	liman	l i m a n	1050	
14	Mailu	hand	1	446	ima	i m a	1050	
15	Tsou	hand	1	350	mucu	m u c u	557	
16	Nias	hand	1	155	taŋa	t a ŋ a	1050	
17	Central Amis	hand	1	19	kamaj	k a m a j	1050	
18	Chamorro	hand	1	2515	kanːai	k a nː a i	1050	
19	Banoni	hand	1	446	numa	n u m a	1050	
20	Singhi	hand	1	155	toŋan	t o ŋ a n	1050	
21	Maloh	left	2	1000	kajoko	k a j o k o	855	
22	Merina (Malagasy)	left	2	-483	havia	h a v i a	855	
23	Palauan	left	2	1253	katur	k a t u r	855	
24	Tunjung	left	2	645	ulaj	u l a j	855	
25	Bare'e	left	2	483	kaiː	k a iː	706	
26	Iban	left	2	560	kibaʔ	k i b a ʔ	855	
27	Berawan (Long Terawan)	left	2	645	pəmaiŋ	p ə m a i ŋ	278	
28	Moken	left	2	1702	ʔeloj	ʔ e l o j	855	
29	Hanunoo	left	2	159	wala	w a l a	855	
30	Wuna	left	2	98	kema	k e m a	855	
31	Tetum	left	2	1881	karuk	k a r u k	855	
32	Mailu	left	2	1934	ebe	e b e	855	
33	Tsou	left	2	483	vrina	v r i n a	726	
34	Nias	left	2	2227	kabera	k a b e r a	855	
35	Central Amis	left	2	483	kawili	k a w i l i	855	
36	Chamorro	left	2	2516	akague	a k a g u e	855	
37	Banoni	left	2	2601	tororona	t o r o r o n a	264	
38	Singhi	left	2	2743	bait	b a i t	487	
39	Banggi	left	2	-159	kuikiwaŋ	k u i k i w a ŋ	530	
40	Maloh	right	3	-519	kato	k a t o	923	
41	Merina (Malagasy)	right	3	255	havanana	h a v a n a n a	923	
42	Palauan	right	3	1254	kadikm	k a d i k m	923	
43	Tunjung	right	3	519	tauʔ	t a u ʔ	923	
44	Bare'e	right	3	255	kana	k a n a	923	
45	Iban	right	3	255	kanan	k a n a n	923	
46	Berawan (Long Terawan)	right	3	519	pəŋkatuʔoh	p ə ŋ k a t u ʔ o h	450	
47	Moken	right	3	255	nanaːn	n a n aː n	923	
48	Hanunoo	right	3	-184	sikun	s i k u n	923	
49	Wuna	right	3	255	swana	s w a n a	923	
50	Tetum	right	3	255	kwana	k w a n a	923	
51	Mailu	right	3	1935	iata	i a t a	410	
52	Tsou	right	3	255	vhona	v h o n a	923	
53	Nias	right	3	2228	kawõlõ	k a w õ l õ	354	
54	Central Amis	right	3	255	kawanan	k a w a n a n	923	
55	Banoni	right	3	519	matoː	m a t oː	923	
56	Singhi	right	3	519	toux	t o u x	923	
57	Banggi	right	3	-184	kikuan	k i k u a n	923	
58	Merina (Malagasy)	leg/foot	4	-97	ranjo	r a n j o	1150	
59	Merina (Malagasy)	leg/foot	4	1053	toŋotra	t o ŋ o t r a	1156	
60	Thao	leg/foot	4	1161	kuskus	k u s k u s	345	
61	Palauan	leg/foot	4	-290	oacʰ	o a cʰ	1150	
62	Tunjung	leg/foot	4	1401	uneŋ	u n e ŋ	1150	
63	Bare'e	leg/foot	4	28	witi	w i t i	23	
64	Iban	leg/foot	4	290	kaki	k a k i	1150	
65	Iban	leg/foot	4	1557	pah	p a h	1150	
66	Berawan (Long Terawan)	leg/foot	4	366	gimaʔ	g i m a ʔ	1150	
67	Moken	leg/foot	4	199	pakaʔ	p a k a ʔ	1150	
68	Moken	leg/foot	4	290	kakaj	k a k a j	1150	
69	Hanunoo	leg/foot	4	1797	raparapa	r a p a r a p a	1150	
70	Wuna	leg/foot	4	290	gʰagʰe	gʰ a gʰ e	1150	
71	Tetum	leg/foot	4	290	ain	a i n	1150	
72	Mailu	leg/foot	4	1936	au	a u	1150	
73	Tsou	leg/foot	4	2099	ruru	r u r u	225	
74	Nias	leg/foot	4	290	ahe	a h e	1150	
75	Central Amis	leg/foot	4	290	waqaj	w a q a j	1150	
76	Chamorro	leg/foot	4	2517	adːeŋ	a dː e ŋ	1150	
77	Banoni	leg/foot	4	2602	rapinːa	r a p i nː a	463	
78	Singhi	leg/foot	4	2744	peun	p e u n	1150	
79	Banggi	leg/foot	4	290	uei	u e i	1150	
80	Maloh	to walk	5	563	lambaʔ	l a m b a ʔ	1017	
81	Merina (Malagasy)	to walk	5	1054	mandéha	m a n d é h a	809	
82	Palauan	to walk	5	212	merael	m e r a e l	99	
83	Tunjung	to walk	5	212	calan	c a l a n	1017	
84	Bare'e	to walk	5	99	linja	l i n j a	1017	
85	Iban	to walk	5	212	jalai	j a l a i	1017	
86	Berawan (Long Terawan)	to walk	5	57	lakaw	l a k a w	1017	
87	Moken	to walk	5	57	lakaw	l a k a w	1017	
88	Hanunoo	to walk	5	57	lumakaw	l u m a k a w	1017	
89	Wuna	to walk	5	362	nokala	n o k a l a	1017	
90	Tetum	to walk	5	57	laʔo	l a ʔ o	1017	
91	Mailu	to walk	5	1937	baebae	b a e b a e	1017	
92	Tsou	to walk	5	2100	coeconʉ	c o e c o n ʉ	1063	
93	Nias	to walk	5	416	fanõ	f a n õ	1017	
94	Central Amis	to walk	5	690	lumakat	l u m a k a t	1017	
95	Central Amis	to walk	5	690	rumakat	r u m a k a t	1017	
96	Chamorro	to walk	5	57	lahu	l a h u	1017	
97	Singhi	to walk	5	416	ponu	p o n u	1017	
98	Banggi	to walk	5	416	empaːno	e m p aː n o	1017	
99	Maloh	road/path	6	95	dalan	d a l a n	813	
100	Merina (Malagasy)	road/path	6	95	lalana	l a l a n a	813	
101	Thao	road/path	6	95	saran	s a r a n	813	
102	Palauan	road/path	6	95	rael	r a e l	813	
103	Tunjung	road/path	6	95	loroŋ	l o r o ŋ	1159	
104	Bare'e	road/path	6	95	jaja	j a j a	813	
105	Iban	road/path	6	95	jalai	j a l a i	813	
106	Berawan (Long Terawan)	road/path	6	95	ilan	i l a n	813	
107	Hanunoo	road/path	6	95	dalan	d a l a n	813	
108	Wuna	road/path	6	95	sala	s a l a	813	
109	Tetum	road/path	6	95	dalan	d a l a n	813	
110	Mailu	road/path	6	1938	laea	l a e a	813	
111	Tsou	road/path	6	95	ceonʉ	c e o n ʉ	813	
112	Nias	road/path	6	95	lala	l a l a	813	
113	Central Amis	road/path	6	95	lalan	l a l a n	813	
114	Chamorro	road/path	6	95	cʰalan	cʰ a l a n	813	
115	Banoni	road/path	6	95	sanana	s a n a n a	813	
116	Singhi	road/path	6	95	aran	a r a n	813	
117	Maloh	to come	7	1001	mondok	m o n d o k	879	
118	Merina (Malagasy)	to come	7	154	avj	a v j	1059	
119	Merina (Malagasy)	to come	7	1055	toŋa	t o ŋ a	675	
120	Thao	to come	7	1162	munaj	m u n a j	1059	
121	Palauan	to come	7	719	méi	m é i	1059	
122	Tunjung	to come	7	1402	moːt	m oː t	1059	
123	Bare'e	to come	7	719	maʔi	m a ʔ i	1059	
124	Iban	to come	7	-561	datai	d a t a i	1059	
125	Berawan (Long Terawan)	to come	7	1631	liʔ	l i ʔ	1059	
126	Moken	to come	7	1703	ŋadin	ŋ a d i n	44	
127	Hanunoo	to come	7	1798	balik	b a l i k	1059	
128	Wuna	to come	7	719	mai	m a i	1059	
129	Tetum	to come	7	719	mai	m a i	1059	
130	Mailu	to come	7	-719	ai	a i	1059	
131	Tsou	to come	7	3	oh	o h	1059	
132	Tsou	to come	7	3	uso	u s o	1059	
133	Nias	to come	7	719	mõi	m õ i	1059	
134	Central Amis	to come	7	2334	tajni	t a j n i	1059	
135	Singhi	to come	7	2745	nug	n u g	879	
136	Banggi	to come	7	2845	miaːtaŋ	m i aː t a ŋ	1059	
137	Maloh	to turn	8	1002	lempaŋ	l e m p a ŋ	842	
138	Merina (Malagasy)	to turn	8	-367	vilj	v i l j	1086	
139	Thao	to turn	8	1163	taushuqish	t a u s h u q i s h	543	
140	Palauan	to turn	8	1255	meŋesoim	m e ŋ e s o i m	11	
141	Tunjung	to turn	8	1403	nencaŋ	n e n c a ŋ	881	
142	Bare'e	to turn	8	591	gili	g i l i	1086	
143	Iban	to turn	8	431	bilok	b i l o k	1086	
144	Berawan (Long Terawan)	to turn	8	1632	ŋəlibiʔ	ŋ ə l i b i ʔ	150	
145	Moken	to turn	8	1704	nʲiliək	nʲ i l i ə k	1086	
146	Hanunoo	to turn	8	1799	simaŋ	s i m a ŋ	842	
147	Wuna	to turn	8	1860	nobelo	n o b e l o	1086	
148	Tetum	to turn	8	-367	filas	f i l a s	1086	
149	Tetum	to turn	8	-367	fila	f i l a	1086	
150	Tetum	to turn	8	-367	faur	f a u r	1086	
151	Tsou	to turn	8	2101	miunu	m i u n u	784	
152	Central Amis	to turn	8	2335	maliwuŋ	m a l i w u ŋ	449	
153	Banoni	to turn	8	2603	beruː	b e r uː	51	
154	Banoni	to turn	8	2604	vegom	v e g o m	1115	
155	Singhi	to turn	8	2746	kus	k u s	1086	
156	Maloh	to swim	9	-311	arananaŋ	a r a n a n a ŋ	1069	
157	Merina (Malagasy)	to swim	9	543	lomano	l o m a n o	1069	
158	Merina (Malagasy)	to swim	9	1056	milomano	m i l o m a n o	1069	
159	Thao	to swim	9	1164	mrauz	m r a u z	1069	
160	Palauan	to swim	9	1256	meŋedub	m e ŋ e d u b	1069	
161	Tunjung	to swim	9	543	karaŋoj	k a r a ŋ o j	1069	
162	Bare'e	to swim	9	543	naŋu	n a ŋ u	1069	
163	Iban	to swim	9	1558	njemerai	n j e m e r a i	1069	
164	Berawan (Long Terawan)	to swim	9	543	pəloŋoj	p ə l o ŋ o j	1069	
165	Moken	to swim	9	543	naŋoj	n a ŋ o j	1069	
166	Hanunoo	to swim	9	543	lumaŋuj	l u m a ŋ u j	1069	
167	Wuna	to swim	9	543	leni	l e n i	1069	
168	Tetum	to swim	9	543	nani	n a n i	1069	
169	Mailu	to swim	9	540	loroloro	l o r o l o r o	635	
170	Mailu	to swim	9	540	rolorolo	r o l o r o l o	873	
171	Tsou	to swim	9	543	euhuŋzu	e u h u ŋ z u	816	
172	Nias	to swim	9	543	molaŋi	m o l a ŋ i	1069	
173	Central Amis	to swim	9	543	laŋuj	l a ŋ u j	1069	
174	Central Amis	to swim	9	543	milaŋuj	m i l a ŋ u j	1069	
175	Chamorro	to swim	9	543	naŋunʲaŋu	n a ŋ u nʲ a ŋ u	1069	
176	Banoni	to swim	9	789	suː	s uː	574	
177	Singhi	to swim	9	543	naŋuj	n a ŋ u j	1069	
178	Merina (Malagasy)	dirty	10	242	maloto	m a l o t o	1198	
179	Thao	dirty	10	1165	marisrisin	m a r i s r i s i n	1198	
180	Palauan	dirty	10	1257	idokel	i d o k e l	121	
181	Tunjung	dirty	10	242	marotaʔ	m a r o t a ʔ	1198	
182	Bare'e	dirty	10	1485	sapa	s a p a	1198	
183	Iban	dirty	10	667	kamah	k a m a h	1198	
184	Berawan (Long Terawan)	dirty	10	1633	labih	l a b i h	1198	
185	Moken	dirty	10	1705	caʔiək	c a ʔ i ə k	1198	
186	Hanunoo	dirty	10	423	majagtiŋ	m a j a g t i ŋ	1198	
187	Hanunoo	dirty	10	423	maʔuriŋ	m a ʔ u r i ŋ	1198	
188	Wuna	dirty	10	785	noraku	n o r a k u	1198	
189	Tetum	dirty	10	1882	kfur	k f u r	1198	
190	Tetum	dirty	10	1883	karebo	k a r e b o	380	
191	Mailu	dirty	10	335	milomilo	m i l o m i l o	133	
192	Tsou	dirty	10	79	cai	c a i	1198	
193	Tsou	dirty	10	79	caʔi	c a ʔ i	1198	
194	Nias	dirty	10	-401	moŋdaʔi	m o ŋ d a ʔ i	770	
195	Central Amis	dirty	10	2336	maacek	m a a c e k	1198	
196	Central Amis	dirty	10	2337	makalit	m a k a l i t	1198	
197	Chamorro	dirty	10	2518	hoplat	h o p l a t	948	
198	Banoni	dirty	10	2605	kiːpi	k iː p i	1198	
199	Singhi	dirty	10	2747	kais	k a i s	1198	
200	Singhi	dirty	10	2748	sirida	s i r i d a	147	
201	Banggi	dirty	10	567	damak	d a m a k	1198	
202	Merina (Malagasy)	dust	11	1057	vovoka	v o v o k a	1113	
203	Bare'e	dust	11	182	awu	a w u	1113	
204	Iban	dust	11	703	abu	a b u	1113	
205	Iban	dust	11	182	apok	a p o k	1113	
206	Berawan (Long Terawan)	dust	11	182	apoʔ	a p o ʔ	1113	
207	Moken	dust	11	703	kaboj	k a b o j	1113	
208	Hanunoo	dust	11	182	gabuk	g a b u k	1113	
209	Hanunoo	dust	11	182	pukapuk	p u k a p u k	1113	
210	Tetum	dust	11	-182	rai#ahun	r a i # a h u n	1113	
211	Mailu	dust	11	1939	veve	v e v e	1153	
212	Central Amis	dust	11	2338	taʔfod	t a ʔ f o d	1113	
213	Banoni	dust	11	2606	ramuta	r a m u t a	1113	
214	Singhi	dust	11	182	abux	a b u x	1113	
215	Singhi	dust	11	182	sapok	s a p o k	1113	
216	Banggi	dust	11	-182	auː	a uː	1113	
217	Maloh	skin	12	216	kulit	k u l i t	1034	
218	Merina (Malagasy)	skin	12	-216	hoditra	h o d i t r a	1034	
219	Thao	skin	12	1166	shapa	s h a p a	1034	
220	Palauan	skin	12	1258	budél	b u d é l	1034	
221	Tunjung	skin	12	216	kulit	k u l i t	1034	
222	Bare'e	skin	12	1486	pela	p e l a	1034	
223	Iban	skin	12	216	kulit	k u l i t	1034	
224	Berawan (Long Terawan)	skin	12	216	kulaiʔ	k u l a i ʔ	1034	
225	Moken	skin	12	1706	bulaŋ	b u l a ŋ	1034	
226	Hanunoo	skin	12	428	tarip	t a r i p	1034	
227	Hanunoo	skin	12	1800	lukub	l u k u b	1034	
228	Wuna	skin	12	216	kuli	k u l i	1034	
229	Tetum	skin	12	216	kulit	k u l i t	1034	
230	Mailu	skin	12	768	opi	o p i	966	
231	Tsou	skin	12	2102	snʉ́fʉ	s n ʉ́ f ʉ	588	
232	Nias	skin	12	216	uli	u l i	1034	
233	Central Amis	skin	12	835	faŋes	f a ŋ e s	1034	
234	Central Amis	skin	12	835	faŋes	f a ŋ e s	1034	
235	Chamorro	skin	12	2519	lasːas	l a sː a s	1034	
236	Banoni	skin	12	2607	kabunu	k a b u n u	966	
237	Singhi	skin	12	216	kurit	k u r i t	1034	
238	Banggi	skin	12	-216	kubal	k u b a l	1034	
239	Maloh	back	13	838	balakaŋ	b a l a k a ŋ	971	
240	Thao	back	13	832	rikus	r i k u s	971	
241	Palauan	back	13	1259	uulk	u u l k	971	
242	Tunjung	back	13	621	puŋuŋ	p u ŋ u ŋ	470	
243	Bare'e	back	13	832	taliku	t a l i k u	971	
244	Iban	back	13	838	belakaŋ	b e l a k a ŋ	971	
245	Berawan (Long Terawan)	back	13	832	likon	l i k o n	971	
246	Moken	back	13	832	lekoːt	l e k oː t	971	
247	Hanunoo	back	13	1801	daju	d a j u	498	
248	Tetum	back	13	111	kotːuk	k o tː u k	929	
249	Mailu	back	13	-157	deniabo	d e n i a b o	271	
250	Mailu	back	13	1940	doe	d o e	971	
251	Tsou	back	13	348	fʔuhu	f ʔ u h u	971	
252	Nias	back	13	2229	hulu	h u l u	971	
253	Central Amis	back	13	2339	kulur	k u l u r	971	
254	Central Amis	back	13	2340	koror	k o r o r	971	
255	Banoni	back	13	2608	tsugʰi	t s u gʰ i	498	
256	Singhi	back	13	2749	dug	d u g	16	
257	Maloh	belly	14	146	bataŋ	b a t a ŋ	1187	
258	Merina (Malagasy)	belly	14	1058	kibo	k i b o	1187	
259	Thao	belly	14	17	tiaz	t i a z	1187	
260	Palauan	belly	14	-17	diil	d i i l	1187	
261	Tunjung	belly	14	1404	naiʔ	n a i ʔ	1187	
262	Bare'e	belly	14	249	kompo	k o m p o	1187	
263	Iban	belly	14	840	perut	p e r u t	1187	
264	Berawan (Long Terawan)	belly	14	17	tijan	t i j a n	1187	
265	Moken	belly	14	1707	lakeʔ	l a k e ʔ	1187	
266	Hanunoo	belly	14	17	tijan	t i j a n	1187	
267	Wuna	belly	14	76	tagʰi	t a gʰ i	1187	
268	Tetum	belly	14	-249	kabun	k a b u n	1187	
269	Mailu	belly	14	1941	amara	a m a r a	1187	
270	Tsou	belly	14	2103	bʉeo	b ʉ e o	727	
271	Nias	belly	14	2230	talu	t a l u	1187	
272	Central Amis	belly	14	17	tial	t i a l	1187	
273	Central Amis	belly	14	17	tial	t i a l	1187	
274	Chamorro	belly	14	17	tujan	t u j a n	1187	
275	Banoni	belly	14	-674	kobi	k o b i	81	
276	Singhi	belly	14	17	tain	t a i n	1187	
277	Banggi	belly	14	17	tiagn	t i a g n	1187	
278	Maloh	bone	15	644	tulaŋ	t u l a ŋ	1020	
279	Merina (Malagasy)	bone	15	644	taolana	t a o l a n a	1020	
280	Thao	bone	15	1167	puqu	p u q u	1020	
281	Palauan	bone	15	1260	cʰiuis	cʰ i u i s	1020	
282	Tunjung	bone	15	1405	lah	l a h	1020	
283	Bare'e	bone	15	475	wuku	w u k u	1020	
284	Iban	bone	15	644	tulaŋ	t u l a ŋ	1020	
285	Berawan (Long Terawan)	bone	15	644	tulaŋ	t u l a ŋ	1020	
286	Moken	bone	15	644	kəlaːn	k ə l aː n	1020	
287	Hanunoo	bone	15	128	butʔul	b u t ʔ u l	1020	
288	Wuna	bone	15	475	buku	b u k u	1020	
289	Tetum	bone	15	778	ruʔin	r u ʔ i n	1020	
290	Mailu	bone	15	1942	kisa	k i s a	275	
291	Tsou	bone	15	644	cʉ́ehʉ	c ʉ́ e h ʉ	497	
292	Nias	bone	15	-644	tõla	t õ l a	1020	
293	Central Amis	bone	15	22	ukak	u k a k	1020	
294	Central Amis	bone	15	22	okak	o k a k	1020	
295	Central Amis	bone	15	22	ukak	u k a k	1020	
296	Banoni	bone	15	2609	sipana	s i p a n a	1020	
297	Singhi	bone	15	644	turaŋ	t u r a ŋ	1020	
298	Banggi	bone	15	644	tulagn	t u l a g n	1020	
299	Maloh	intestines	16	723	parut	p a r u t	952	
300	Merina (Malagasy)	intestines	16	524	tsinaj	t s i n a j	993	
301	Thao	intestines	16	1168	rumrum	r u m r u m	238	
302	Palauan	intestines	16	-524	delacʰ	d e l a cʰ	993	
303	Tunjung	intestines	16	-524	usiʔ#ŋaiʔ	u s i ʔ # ŋ a i ʔ	174	
304	Bare'e	intestines	16	1487	wajaː#ntaʔi	w a j aː # n t a ʔ i	1051	
305	Iban	intestines	16	723	perut	p e r u t	952	
306	Berawan (Long Terawan)	intestines	16	524	tənaiʔ	t ə n a i ʔ	993	
307	Hanunoo	intestines	16	605	bitukaʔ	b i t u k a ʔ	993	
308	Hanunoo	intestines	16	605	punaʔ	p u n a ʔ	993	
309	Wuna	intestines	16	1861	ihi#no#tagʰi	i h i # n o # t a gʰ i	993	
310	Tetum	intestines	16	1884	te#oan	t e # o a n	993	
311	Mailu	intestines	16	524	sinae	s i n a e	993	
312	Tsou	intestines	16	2104	soeu	s o e u	810	
313	Nias	intestines	16	605	betuʔa	b e t u ʔ a	993	
314	Nias	intestines	16	605	riʔi	r i ʔ i	139	
315	Central Amis	intestines	16	524	tinaiq	t i n a i q	993	
316	Central Amis	intestines	16	524	tinaiʕ	t i n a i ʕ	993	
317	Banoni	intestines	16	333	kore	k o r e	362	
318	Maloh	liver	17	297	até	a t é	1092	
319	Merina (Malagasy)	liver	17	297	atj	a t j	1092	
320	Thao	liver	17	170	rishi	r i s h i	1092	
321	Palauan	liver	17	-297	cʰad	cʰ a d	1092	
322	Tunjung	liver	17	1406	limpa	l i m p a	797	
323	Bare'e	liver	17	297	ate	a t e	1092	
324	Iban	liver	17	297	atau	a t a u	1092	
325	Berawan (Long Terawan)	liver	17	297	ataj	a t a j	1092	
326	Moken	liver	17	297	kataj	k a t a j	1092	
327	Hanunoo	liver	17	297	ataj	a t a j	1092	
328	Wuna	liver	17	297	gʰete	gʰ e t e	1092	
329	Tetum	liver	17	297	aten	a t e n	1092	
330	Mailu	liver	17	1943	arame	a r a m e	1092	
331	Tsou	liver	17	2105	hʔonu	h ʔ o n u	411	
332	Nias	liver	17	297	ate	a t e	1092	
333	Central Amis	liver	17	297	ataj	a t a j	1092	
334	Central Amis	liver	17	297	ʕataj	ʕ a t a j	1092	
335	Banoni	liver	17	297	date	d a t e	1092	
336	Singhi	liver	17	297	atin	a t i n	1092	
337	Banggi	liver	17	297	ati	a t i	1092	
338	Maloh	breast	18	331	susu	s u s u	1071	
339	Merina (Malagasy)	breast	18	205	nono	n o n o	1071	
340	Thao	breast	18	331	tutu	t u t u	1071	
341	Palauan	breast	18	331	tut	t u t	1071	
342	Tunjung	breast	18	1407	tosoq	t o s o q	1071	
343	Bare'e	breast	18	331	susu	s u s u	1071	
344	Iban	breast	18	331	tusu	t u s u	1071	
345	Berawan (Long Terawan)	breast	18	300	iteʔ	i t e ʔ	1071	
346	Moken	breast	18	755	dadaʔ	d a d a ʔ	39	
347	Hanunoo	breast	18	331	susu	s u s u	1071	
348	Wuna	breast	18	300	titi	t i t i	1071	
349	Tetum	breast	18	331	susun	s u s u n	1071	
350	Mailu	breast	18	1944	hama	h a m a	6	
351	Tsou	breast	18	205	nunʔu	n u n ʔ u	1071	
352	Nias	breast	18	331	fosu	f o s u	1071	
353	Nias	breast	18	331	susu	s u s u	1071	
354	Central Amis	breast	18	2341	faluhaŋ	f a l u h a ŋ	592	
355	Central Amis	breast	18	2342	falohaŋ	f a l o h a ŋ	501	
356	Central Amis	breast	18	331	cucu	c u c u	1071	
357	Chamorro	breast	18	331	susu	s u s u	1071	
358	Banoni	breast	18	331	su	s u	1071	
359	Banggi	breast	18	759	dudu	d u d u	1071	
360	Maloh	shoulder	19	419	babaŋ	b a b a ŋ	1192	
361	Merina (Malagasy)	shoulder	19	1059	soroka	s o r o k a	642	
362	Thao	shoulder	19	102	qalhafa	q a l h a f a	1192	
363	Palauan	shoulder	19	1261	oŋeluŋel	o ŋ e l u ŋ e l	577	
364	Tunjung	shoulder	19	1408	bahuq	b a h u q	1192	
365	Bare'e	shoulder	19	102	awaː	a w aː	1192	
366	Iban	shoulder	19	295	bau	b a u	1192	
367	Berawan (Long Terawan)	shoulder	19	-102	bikih	b i k i h	1192	
368	Hanunoo	shoulder	19	1802	labaj	l a b a j	1192	
369	Wuna	shoulder	19	-102	gʰofea	gʰ o f e a	397	
370	Tetum	shoulder	19	-135	baːs	b aː s	570	
371	Mailu	shoulder	19	1945	gabi	g a b i	576	
372	Tsou	shoulder	19	2106	eiʔsi	e i ʔ s i	911	
373	Nias	shoulder	19	2231	alisi	a l i s i	911	
374	Central Amis	shoulder	19	102	afala	a f a l a	1192	
375	Central Amis	shoulder	19	102	ʔafala	ʔ a f a l a	1192	
376	Chamorro	shoulder	19	102	apaga	a p a g a	1192	
377	Banoni	shoulder	19	2610	dzaneko	d z a n e k o	242	
378	Singhi	shoulder	19	781	papi	p a p i	576	
379	Banggi	shoulder	19	2846	owu	o w u	1192	
380	Maloh	to know, be knowledgeable	20	-137	tamu	t a m u	840	
381	Merina (Malagasy)	to know, be knowledgeable	20	1060	mahalala	m a h a l a l a	840	
382	Thao	to know, be knowledgeable	20	631	mafazaq	m a f a z a q	840	
383	Palauan	to know, be knowledgeable	20	1262	meducʰ	m e d u cʰ	840	
384	Tunjung	to know, be knowledgeable	20	1409	togaʔ	t o g a ʔ	500	
385	Bare'e	to know, be knowledgeable	20	1488	inca	i n c a	917	
386	Iban	to know, be knowledgeable	20	137	tauʔ	t a u ʔ	840	
387	Iban	to know, be knowledgeable	20	1559	temu	t e m u	840	
388	Berawan (Long Terawan)	to know, be knowledgeable	20	1634	ninʲon	n i nʲ o n	206	
389	Moken	to know, be knowledgeable	20	1708	nʲədan	nʲ ə d a n	840	
390	Hanunoo	to know, be knowledgeable	20	137	taʔu	t a ʔ u	840	
391	Wuna	to know, be knowledgeable	20	204	pandehao	p a n d e h a o	869	
392	Tetum	to know, be knowledgeable	20	655	hatana	h a t a n a	840	
393	Mailu	to know, be knowledgeable	20	793	ribariba	r i b a r i b a	712	
394	Mailu	to know, be knowledgeable	20	1946	vegarai	v e g a r a i	823	
395	Tsou	to know, be knowledgeable	20	271	bocʰio	b o cʰ i o	270	
396	Nias	to know, be knowledgeable	20	2232	ila	i l a	917	
397	Central Amis	to know, be knowledgeable	20	631	mafanaq	m a f a n a q	840	
398	Central Amis	to know, be knowledgeable	20	631	mafanaʔ	m a f a n a ʔ	840	
399	Banoni	to know, be knowledgeable	20	2611	kuki	k u k i	56	
400	Banoni	to know, be knowledgeable	20	2612	vonogu	v o n o g u	329	
401	Singhi	to know, be knowledgeable	20	2750	puan	p u a n	36	
402	Banggi	to know, be knowledgeable	20	2847	fandi	f a n d i	688	
403	Merina (Malagasy)	to think	21	1061	mihévitra	m i h é v i t r a	957	
404	Thao	to think	21	1169	maŋqtu	m a ŋ q t u	900	
405	Palauan	to think	21	1263	omdasu	o m d a s u	541	
406	Bare'e	to think	21	1489	monawa	m o n a w a	947	
407	Iban	to think	21	1560	rundiŋ	r u n d i ŋ	947	
408	Moken	to think	21	565	məkʰit	m ə kʰ i t	947	
409	Hanunoo	to think	21	565	umisip	u m i s i p	947	
410	Hanunoo	to think	21	565	magduman	m a g d u m a n	947	
411	Tetum	to think	21	500	hanoʔin	h a n o ʔ i n	947	
412	Mailu	to think	21	-752	sunaːvini	s u n aː v i n i	1029	
413	Tsou	to think	21	2107	maʔmi	m a ʔ m i	687	
414	Nias	to think	21	2233	wai	w a i	458	
415	Central Amis	to think	21	2343	miharateŋ	m i h a r a t e ŋ	314	
416	Central Amis	to think	21	2344	miharateŋ	m i h a r a t e ŋ	189	
417	Chamorro	to think	21	2520	hasːo	h a sː o	947	
418	Banoni	to think	21	2613	varekana	v a r e k a n a	715	
419	Singhi	to think	21	2751	saka#ŋasuŋ	s a k a # ŋ a s u ŋ	1009	
420	Maloh	to fear	22	787	takut	t a k u t	1118	
421	Merina (Malagasy)	to fear	22	787	tahotra	t a h o t r a	1118	
422	Thao	to fear	22	1170	shuŋkash	s h u ŋ k a s h	1188	
423	Palauan	to fear	22	787	dakt	d a k t	1118	
424	Tunjung	to fear	22	1410	bihin	b i h i n	304	
425	Bare'e	to fear	22	330	maeka	m a e k a	1118	
426	Iban	to fear	22	787	takut	t a k u t	1118	
427	Berawan (Long Terawan)	to fear	22	1635	bikaʔ	b i k a ʔ	1118	
428	Moken	to fear	22	1709	gajaːŋ	g a j aː ŋ	630	
429	Moken	to fear	22	-787	lakoːt	l a k oː t	1118	
430	Hanunoo	to fear	22	1803	dalaʔ	d a l a ʔ	1118	
431	Wuna	to fear	22	753	notehi	n o t e h i	1118	
432	Tetum	to fear	22	787	hatauk	h a t a u k	1118	
433	Mailu	to fear	22	-787	taguru	t a g u r u	1118	
434	Tsou	to fear	22	2108	skoeu	s k o e u	243	
435	Nias	to fear	22	787	taʔu	t a ʔ u	1118	
436	Central Amis	to fear	22	798	matalaw	m a t a l a w	1118	
437	Chamorro	to fear	22	2521	kinibatde	k i n i b a t d e	709	
438	Banoni	to fear	22	2614	vere	v e r e	1121	
439	Singhi	to fear	22	2752	toru	t o r u	1118	
440	Banggi	to fear	22	2848	molok	m o l o k	1118	
441	Maloh	blood	23	572	daraʔ	d a r a ʔ	1075	
442	Merina (Malagasy)	blood	23	572	ra	r a	1075	
443	Thao	blood	23	1171	talhum	t a l h u m	1075	
444	Palauan	blood	23	1264	rasecʰ	r a s e cʰ	1075	
445	Tunjung	blood	23	572	rahaʔ	r a h a ʔ	1075	
446	Bare'e	blood	23	572	daː	d aː	1075	
447	Iban	blood	23	572	darah	d a r a h	1075	
448	Berawan (Long Terawan)	blood	23	346	səma	s ə m a	1127	
449	Moken	blood	23	572	dalaːk	d a l aː k	1075	
450	Hanunoo	blood	23	396	duguʔ	d u g u ʔ	1075	
451	Wuna	blood	23	572	rea	r e a	1075	
452	Tetum	blood	23	572	raːn	r aː n	1075	
453	Mailu	blood	23	572	lala	l a l a	1075	
454	Tsou	blood	23	2109	hmueu	h m u e u	1116	
455	Nias	blood	23	572	do	d o	1075	
456	Central Amis	blood	23	2345	remes	r e m e s	1075	
457	Banoni	blood	23	2615	ŋatsi	ŋ a t s i	1075	
458	Singhi	blood	23	572	doja	d o j a	1075	
459	Banggi	blood	23	572	raːh	r aː h	1075	
460	Maloh	head	24	442	ulu	u l u	894	
461	Merina (Malagasy)	head	24	1062	loha	l o h a	894	
462	Thao	head	24	552	punuq	p u n u q	894	
463	Palauan	head	24	1265	klidm	k l i d m	695	
464	Tunjung	head	24	438	kuhuŋ	k u h u ŋ	894	
465	Bare'e	head	24	1490	woʔo	w o ʔ o	219	
466	Berawan (Long Terawan)	head	24	442	uloh	u l o h	894	
467	Hanunoo	head	24	442	ulu	u l u	894	
468	Wuna	head	24	578	fotu	f o t u	894	
469	Tetum	head	24	442	ulun	u l u n	894	
470	Mailu	head	24	442	uru	u r u	894	
471	Mailu	head	24	442	moru	m o r u	894	
472	Tsou	head	24	530	fŋuu	f ŋ u u	230	
473	Nias	head	24	2234	hõgõ	h õ g õ	826	
474	Central Amis	head	24	516	taŋar	t a ŋ a r	420	
475	Central Amis	head	24	530	fuŋoh	f u ŋ o h	894	
476	Chamorro	head	24	442	ulu	u l u	894	
477	Banoni	head	24	2616	tope	t o p e	894	
478	Singhi	head	24	2753	bak	b a k	894	
479	Banggi	head	24	442	ulu	u l u	894	
480	Maloh	neck	25	1003	kaloŋ	k a l o ŋ	1109	
481	Merina (Malagasy)	neck	25	1063	vozona	v o z o n a	1109	
482	Thao	neck	25	1172	buqtur	b u q t u r	1109	
483	Palauan	neck	25	1266	cʰikl	cʰ i k l	1109	
484	Tunjung	neck	25	-544	lohoŋ	l o h o ŋ	1109	
485	Bare'e	neck	25	1491	taŋgude	t a ŋ g u d e	1137	
486	Iban	neck	25	1561	rekoŋ	r e k o ŋ	1109	
487	Berawan (Long Terawan)	neck	25	-557	bitoʔ	b i t o ʔ	1109	
488	Moken	neck	25	1710	tukʰoː	t u kʰ oː	1109	
489	Moken	neck	25	421	buloːŋ	b u l oː ŋ	1109	
490	Hanunoo	neck	25	220	liʔug	l i ʔ u g	1109	
491	Wuna	neck	25	94	wugʰu	w u gʰ u	1109	
492	Tetum	neck	25	-643	kakorok	k a k o r o k	353	
493	Mailu	neck	25	1947	kusani	k u s a n i	833	
494	Tsou	neck	25	2110	sʉ́nʉ	s ʉ́ n ʉ	435	
495	Nias	neck	25	2235	bagi	b a g i	154	
496	Central Amis	neck	25	220	liqer	l i q e r	1109	
497	Central Amis	neck	25	220	liʕer	l i ʕ e r	1109	
498	Banoni	neck	25	657	kokoromo	k o k o r o m o	353	
499	Singhi	neck	25	-325	tuŋoe	t u ŋ o e	1109	
500	Banggi	neck	25	2849	tigoru	t i g o r u	1109	
501	Maloh	hair	26	252	buk	b u k	870	
502	Merina (Malagasy)	hair	26	-126	volo	v o l o	870	
503	Thao	hair	26	252	fukish	f u k i s h	870	
504	Palauan	hair	26	-252	cʰui	cʰ u i	870	
505	Tunjung	hair	26	677	alaw	a l a w	870	
506	Bare'e	hair	26	-126	wujua	w u j u a	870	
507	Iban	hair	26	252	bok	b o k	870	
508	Berawan (Long Terawan)	hair	26	252	puʔ	p u ʔ	870	
509	Moken	hair	26	1711	buloj	b u l o j	870	
510	Hanunoo	hair	26	252	buhuk	b u h u k	870	
511	Wuna	hair	26	126	vulu#no#fotu	v u l u # n o # f o t u	870	
512	Tetum	hair	26	252	fuːk	f uː k	870	
513	Mailu	hair	26	441	limuː	l i m uː	306	
514	Tsou	hair	26	252	fʔʉ́sʉ	f ʔ ʉ́ s ʉ	426	
515	Nias	hair	26	252	bu	b u	870	
516	Central Amis	hair	26	252	fukes	f u k e s	870	
517	Chamorro	hair	26	126	gapotulu	g a p o t u l u	870	
518	Chamorro	hair	26	586	pulu	p u l u	870	
519	Banoni	hair	26	586	punu	p u n u	870	
520	Singhi	hair	26	252	boek	b o e k	870	
521	Banggi	hair	26	252	obuk	o b u k	870	
522	Maloh	nose	27	1004	iŋar	i ŋ a r	1193	
523	Merina (Malagasy)	nose	27	26	orona	o r o n a	1193	
524	Thao	nose	27	316	muzin	m u z i n	540	
525	Palauan	nose	27	1267	iis	i i s	1193	
